product_id,product_name,category,price,cost,supplier,launch_date
276,Re-contextualized intangible approach Two,Beauty,11.86,6.55,Wheeler-Roberts,2024-04-16
277,Open-source static moratorium Mouth,Clothing,32.45,14.4,James-Garcia,2024-12-03
278,Programmable static implementation Left,Home & Garden,10.09,3.45,"Jackson, Crosby and Mercado",2024-03-08
279,Synchronized transitional toolset Fear,Sports,12.38,5.31,Hernandez Ltd,2024-02-19
280,Upgradable context-sensitive access Give,Toys,3.78,1.39,Murray Ltd,2025-06-28
281,Synergized tangible algorithm Red,Home & Garden,15.87,10.74,Moore-Weaver,2025-07-02
282,Inverse methodical monitoring Fine,Electronics,8.41,3.6,"Salinas, Gomez and Moore",2023-12-05
283,Open-architected context-sensitive circuit Test,Beauty,21.4,9.28,"Anderson, Gibson and Simmons",2024-08-22
284,Cloned impactful database Everybody,Home & Garden,9.39,5.97,Moran-Hurst,2025-02-07
285,Visionary incremental groupware Best,Home & Garden,21.84,12.21,Hernandez-Miller,2024-04-01
286,Public-key uniform initiative Toward,Toys,17.89,10.45,"Steele, Bender and Brown",2023-09-09
287,Intuitive zero administration budgetary management Half,Clothing,76.53,42.43,Morris-Rivera,2023-12-20
288,Focused attitude-oriented capacity Attack,Beauty,29.9,20.29,"Myers, Stevens and Phillips",2024-06-07
289,Implemented asynchronous service-desk Town,Clothing,4.61,1.76,Richardson Inc,2024-05-17
290,Focused transitional model Car,Sports,7.3,5.08,Chavez-Torres,2024-05-10
291,Self-enabling reciprocal middleware Quality,Home & Garden,20.99,13.27,Green-Jacobs,2024-10-17
292,Polarized regional application Night,Beauty,9.55,5.11,"Tyler, Elliott and Williams",2024-04-25
293,User-friendly upward-trending Internet solution Recent,Home & Garden,1.87,1.06,"Henry, Martinez and Ross",2024-12-09
294,Profound interactive functionalities Store,Sports,59.12,33.08,"Vasquez, Kemp and Rodgers",2024-01-05
295,Customer-focused scalable extranet Leave,Books,35.74,11.56,"Williams, Smith and Martin",2024-03-08
296,Open-source actuating toolset Story,Sports,30.47,11.8,Joyce-Johnston,2024-05-28
297,Customer-focused modular access Such,Clothing,12.36,8.46,Robinson Ltd,2024-10-25
298,Visionary user-facing hardware Our,Clothing,28.28,14.53,"Smith, Gillespie and Castro",2025-08-06
299,Front-line reciprocal instruction set Major,Automotive,11.43,5.16,Turner PLC,2023-09-26
300,Automated bi-directional solution Good,Home & Garden,23.66,14.31,Trujillo-Martinez,2023-12-24
301,Multi-layered system-worthy concept Create,Clothing,9.62,4.9,Mann-Tyler,2024-02-17
302,Networked fault-tolerant archive Sing,Beauty,67.56,20.62,Riddle and Sons,2025-02-28
303,Devolved empowering info-mediaries Wear,Sports,5.72,3.4,"Garrett, Brown and Larsen",2025-03-04
304,Multi-layered full-range collaboration Rise,Home & Garden,53.83,31.92,"Hahn, Boyle and Lee",2024-02-26
305,Switchable user-facing policy Herself,Sports,20.72,7.58,Adams-Garcia,2023-11-19
306,Universal mobile open architecture Local,Sports,13.58,9.27,Alexander and Sons,2023-09-09
307,Exclusive foreground budgetary management Hundred,Home & Garden,22.96,8.94,Hernandez Ltd,2024-09-15
308,Quality-focused disintermediate challenge Accept,Toys,36.11,17.44,"Wood, Benson and Norton",2023-11-03
309,Enterprise-wide cohesive website Use,Books,59.94,20.73,Pierce-Robertson,2024-09-12
310,Persistent transitional capability Beautiful,Automotive,25.8,13.97,"Gardner, Wise and Weaver",2024-05-19
311,Extended solution-oriented artificial intelligence Month,Toys,9.85,4.43,"Diaz, Abbott and Knight",2025-01-02
312,Business-focused analyzing circuit Beautiful,Clothing,21.0,9.27,Taylor and Sons,2024-03-22
313,User-friendly even-keeled policy Natural,Electronics,85.92,54.2,"Aguilar, Baxter and Castillo",2025-02-27
314,Business-focused 5thgeneration success Southern,Automotive,59.04,17.94,Howell and Sons,2024-10-07
315,Public-key eco-centric intranet Rich,Toys,41.55,25.73,"Young, Solis and Bates",2025-03-06
316,Intuitive full-range hierarchy Likely,Electronics,37.96,20.06,"Foster, Sawyer and Davis",2023-09-05
317,Synergized mobile encryption Fill,Electronics,35.15,24.41,Barnes Inc,2025-05-14
318,Synergized secondary data-warehouse Citizen,Clothing,50.75,27.19,Bean-Rivas,2024-04-27
319,Realigned contextually-based emulation Use,Books,13.94,4.49,"Perry, Gonzalez and Williams",2025-03-19
320,Robust asymmetric core Care,Sports,6.79,2.17,Daniels Group,2025-01-28
321,Switchable tertiary architecture Often,Home & Garden,21.23,13.87,"Jones, Duncan and Scott",2025-04-20
322,Sharable disintermediate instruction set In,Books,10.44,6.64,Castillo-Mcdonald,2023-10-29
323,Reduced uniform firmware Price,Electronics,8.64,3.79,Hale-Rush,2024-03-01
324,Programmable dynamic help-desk People,Automotive,11.29,6.18,"Russell, Marks and Scott",2024-02-17
325,Profound secondary access Need,Beauty,146.68,72.73,Willis-Wilson,2025-01-11
326,Future-proofed human-resource policy Name,Clothing,22.4,15.39,Miller-Rodriguez,2024-09-21
327,Versatile modular database Certainly,Toys,26.83,18.24,Caldwell-Alexander,2024-09-26
328,Re-engineered zero tolerance knowledgebase Wait,Automotive,7.55,5.24,Morris Group,2025-02-19
329,Intuitive multimedia flexibility Sometimes,Clothing,4.6,2.97,Smith Inc,2024-01-01
330,Managed interactive circuit Matter,Toys,10.43,6.92,"Burgess, Fox and Taylor",2024-08-19
331,Customer-focused secondary core Man,Home & Garden,63.47,24.56,"Turner, Dickerson and Smith",2024-02-09
332,Business-focused responsive circuit Event,Beauty,26.24,16.59,Davidson Group,2024-08-31
333,Innovative hybrid pricing structure Network,Sports,32.42,18.92,Washington LLC,2024-12-23
334,Grass-roots grid-enabled open system Number,Books,36.26,24.84,Wilson LLC,2025-04-10
335,Seamless uniform algorithm Play,Beauty,12.51,6.61,Freeman Ltd,2025-05-28
336,Centralized homogeneous initiative Wonder,Books,60.97,20.37,"Thomas, Jones and Martinez",2024-03-12
337,Assimilated object-oriented framework Manage,Books,12.11,6.53,Walker-Jones,2025-07-19
338,Progressive dedicated application Team,Sports,61.87,35.55,Reyes-Boyer,2024-11-09
339,Operative client-server interface Fill,Sports,28.61,11.1,"Moore, Murray and Sherman",2023-09-22
340,Open-architected uniform groupware Morning,Toys,4.8,2.2,"Gonzales, Marshall and Owens",2024-11-15
341,Public-key non-volatile parallelism On,Sports,11.04,5.95,"Armstrong, Graves and Russell",2024-11-05
342,Proactive context-sensitive flexibility Executive,Home & Garden,4.82,2.17,Lopez-Buckley,2024-03-06
343,Virtual exuding info-mediaries Whatever,Clothing,50.94,22.92,Sellers-Rivera,2025-01-09
344,Fully-configurable attitude-oriented circuit Should,Electronics,19.69,6.96,Mitchell-Malone,2024-03-22
345,Progressive systemic focus group Style,Sports,3.38,2.29,Austin PLC,2024-09-07
346,Devolved systemic analyzer Particularly,Clothing,27.13,16.28,Green Ltd,2023-10-27
347,Enhanced logistical function Pay,Toys,13.07,3.93,"Best, Harrington and Larson",2024-10-05
348,Fully-configurable systemic open system Their,Sports,6.13,3.72,Davis-Neal,2025-06-21
349,Balanced optimizing model Best,Electronics,76.89,45.82,Kramer-Mendez,2025-07-24
350,Synergized attitude-oriented circuit Certainly,Beauty,21.89,6.65,"Davis, Jimenez and Walton",2024-12-28
351,Automated contextually-based system engine Back,Automotive,15.88,7.11,Mack-Nguyen,2025-04-12
352,Mandatory solution-oriented attitude Certainly,Sports,14.59,7.92,"Smith, Gillespie and Stephens",2025-07-19
353,Stand-alone systemic middleware Health,Clothing,5.99,2.88,Miller Inc,2025-06-22
354,Configurable demand-driven info-mediaries Mr,Toys,7.07,4.32,Johnson Ltd,2023-10-08
355,Grass-roots 5thgeneration Graphic Interface Fill,Toys,56.14,26.4,Fernandez-Kaufman,2025-02-28
356,Customer-focused transitional info-mediaries Relationship,Automotive,13.75,4.97,Braun PLC,2024-01-21
357,Managed composite emulation Middle,Home & Garden,20.44,14.12,Oconnor and Sons,2025-05-21
358,Advanced 24hour throughput Note,Toys,3.91,1.55,Fowler-Jones,2025-06-21
359,Organized modular leverage Hot,Beauty,7.0,4.11,"Washington, Mcgee and Clark",2023-12-08
360,Compatible reciprocal application Social,Toys,32.72,11.69,Lopez Inc,2024-04-04
361,Balanced demand-driven conglomeration Cold,Toys,27.17,11.73,"Robertson, Weber and Hall",2025-03-30
362,Up-sized intermediate algorithm Maybe,Beauty,81.67,38.94,"Hernandez, Wells and Sawyer",2023-09-16
363,Front-line executive task-force Turn,Automotive,58.81,22.17,"Carter, Wood and Keller",2024-06-28
364,Persistent multimedia synergy Few,Automotive,16.7,8.02,Barber-Campbell,2023-12-12
365,Front-line cohesive interface Manage,Beauty,29.32,10.64,Barr-Valentine,2025-07-04
366,Function-based national function Knowledge,Electronics,15.59,8.16,Stone-Snyder,2023-10-12
367,Future-proofed scalable definition Bank,Clothing,103.94,58.78,"Copeland, Roberts and Robles",2025-03-01
368,Vision-oriented analyzing workforce Detail,Books,50.36,16.37,"Daniel, Stevens and Ochoa",2024-03-26
369,Devolved didactic emulation Off,Toys,23.01,14.92,Collins-Russell,2024-06-30
370,Switchable heuristic workforce Even,Automotive,23.58,8.82,Grant-Cole,2023-10-30
371,Fully-configurable local structure Learn,Books,63.81,24.9,"Reese, Martinez and Smith",2024-02-14
372,Polarized disintermediate approach Skin,Books,31.93,18.03,Martinez-Kennedy,2024-02-02
373,Multi-channeled neutral Graphical User Interface Note,Home & Garden,69.89,34.07,"Beltran, Oneill and Lee",2024-05-16
374,Enhanced asynchronous process improvement Knowledge,Sports,3.47,1.73,Miller-Castro,2024-03-07
375,User-friendly even-keeled task-force Growth,Toys,29.05,10.2,Davila-Jacobs,2024-07-23
376,Robust reciprocal instruction set Offer,Sports,13.3,8.28,Barr PLC,2024-01-11
377,Distributed client-driven flexibility Describe,Sports,81.87,44.77,Holmes-Wise,2025-04-27
378,Cross-group client-driven software Reduce,Home & Garden,69.21,24.51,"Johnson, Jones and Mason",2025-03-02
379,Configurable coherent help-desk History,Books,20.62,9.27,Thompson Inc,2024-02-26
380,Profit-focused motivating pricing structure Nature,Beauty,68.61,42.82,Villanueva and Sons,2024-08-18
381,Exclusive user-facing pricing structure Concern,Sports,83.64,44.11,Yates-Maynard,2023-10-02
382,Team-oriented demand-driven adapter Me,Automotive,21.32,7.32,"Rodriguez, Hamilton and Jones",2023-12-27
383,Quality-focused bottom-line flexibility Bring,Beauty,145.12,65.17,Choi Group,2025-06-17
384,De-engineered zero-defect throughput Girl,Beauty,19.59,7.78,Jackson LLC,2025-04-05
385,Persistent 3rdgeneration protocol Itself,Home & Garden,16.92,8.58,"Garcia, Gonzalez and Stewart",2024-04-23
386,Organized analyzing knowledgebase Moment,Automotive,40.15,25.59,Robles PLC,2024-04-24
387,Secured tertiary service-desk Side,Home & Garden,15.13,7.18,Roberts-Freeman,2024-05-13
388,Up-sized solution-oriented project Cultural,Clothing,21.5,10.18,Salinas and Sons,2025-03-26
389,Innovative eco-centric structure Television,Toys,62.03,41.07,"King, Ramsey and Garcia",2025-05-17
390,Mandatory exuding support That,Sports,20.4,10.82,Kelly Ltd,2025-03-22
391,Phased fresh-thinking projection Play,Books,5.18,2.73,Brown LLC,2025-02-03
392,Organic asymmetric benchmark During,Electronics,26.95,10.91,Lopez PLC,2024-06-16
393,Customizable holistic workforce Somebody,Automotive,11.51,6.25,Fernandez PLC,2024-01-13
394,Team-oriented intangible website New,Home & Garden,40.13,21.28,"Wilson, Carter and Rocha",2024-03-30
395,Pre-emptive demand-driven budgetary management Report,Beauty,35.06,16.08,Barrett-Jordan,2024-12-19
396,Balanced clear-thinking framework Coach,Clothing,65.18,45.38,"Owens, Harris and Lee",2024-10-17
397,Networked explicit functionalities Plant,Electronics,41.51,27.1,Henry PLC,2023-11-18
398,Up-sized interactive emulation Owner,Home & Garden,48.05,28.82,"Adams, Gilbert and Robinson",2025-07-18
399,Grass-roots interactive moderator Few,Clothing,11.76,6.06,Bell-Lewis,2024-03-10
400,Multi-layered multimedia data-warehouse Section,Beauty,38.21,18.53,Tanner-Fleming,2023-11-14
401,Cross-platform 24/7 website Page,Sports,97.0,36.27,Moreno-Turner,2025-06-11
402,Advanced content-based hardware One,Toys,11.58,4.89,"Garcia, Larson and James",2025-06-30
403,Synergistic grid-enabled middleware Seem,Toys,84.76,51.67,"Mendez, Kidd and Garcia",2025-01-01
404,Phased client-driven implementation Customer,Clothing,12.94,6.23,Li-Jones,2024-05-18
405,Synergized contextually-based solution Suggest,Home & Garden,10.16,6.63,Smith Ltd,2024-08-11
406,Phased grid-enabled alliance This,Toys,25.46,9.14,Braun-Curry,2024-08-04
407,Enterprise-wide mobile productivity Avoid,Toys,35.61,17.92,Wright-Hunt,2025-01-14
408,Robust coherent info-mediaries Follow,Sports,41.65,23.27,Knox LLC,2023-11-12
409,Enterprise-wide bifurcated synergy According,Beauty,9.31,4.72,Brooks Group,2024-10-24
410,Enhanced disintermediate neural-net Statement,Books,28.44,18.65,"Roberts, Vega and Schultz",2023-09-30
411,Organic cohesive model Thought,Toys,11.61,8.08,"Abbott, Benson and Brown",2025-03-20
412,Reactive 4thgeneration matrix Enjoy,Clothing,6.1,2.11,Williams Group,2024-08-01
413,Optional intangible support Vote,Electronics,9.55,3.36,Lin-Dunn,2025-07-28
414,Vision-oriented transitional productivity Food,Automotive,11.02,3.88,"Cervantes, Franklin and Wells",2024-02-29
415,Re-contextualized modular analyzer Human,Beauty,30.49,17.45,Shields LLC,2024-10-29
416,Streamlined regional functionalities Particular,Sports,50.49,22.67,Floyd-Barrett,2023-11-30
417,Triple-buffered regional ability Should,Beauty,6.18,3.67,Williams-Blankenship,2023-12-07
418,Upgradable systemic product But,Sports,26.62,12.3,Jensen-Kline,2025-03-23
419,Re-contextualized impactful protocol Professor,Beauty,7.84,4.32,Bates and Sons,2025-01-13
420,Future-proofed directional synergy Recently,Automotive,33.22,20.2,Jackson-Adams,2024-12-31
421,Universal disintermediate hardware Job,Books,12.2,6.34,Byrd-Hudson,2025-08-08
422,Digitized content-based paradigm Goal,Clothing,8.66,4.47,Noble-Garrett,2025-07-03
423,Assimilated context-sensitive archive Voice,Electronics,38.08,12.77,Becker Group,2024-01-11
424,Compatible bottom-line migration Market,Toys,12.56,5.83,"Stewart, Anderson and King",2024-12-10
425,Adaptive systemic analyzer Above,Books,15.6,8.09,Harrison-Alexander,2025-06-01
426,Balanced national challenge Country,Clothing,3.4,1.65,Montgomery Group,2024-07-16
427,De-engineered analyzing help-desk Eat,Electronics,42.83,28.28,"Washington, Lee and Smith",2024-07-04
428,De-engineered value-added concept And,Beauty,38.73,25.66,Flores-Miller,2024-05-24
429,Quality-focused optimizing encoding Parent,Automotive,20.17,12.68,Stephens Group,2023-12-02
430,Universal heuristic info-mediaries Space,Toys,5.92,2.66,White-Fischer,2024-10-04
431,Business-focused multi-tasking orchestration Newspaper,Electronics,52.85,31.02,"Weeks, Smith and Neal",2024-12-22
432,Assimilated explicit interface Identify,Home & Garden,11.79,5.4,Stevens Group,2024-05-28
433,Compatible local budgetary management Thing,Electronics,13.98,5.49,"Taylor, Williamson and Ramsey",2025-02-13
434,Advanced background forecast Many,Clothing,127.69,55.82,Price-Patel,2023-11-07
435,Public-key contextually-based firmware Table,Books,11.44,3.76,Ross LLC,2024-12-26
436,Persistent heuristic open system Positive,Toys,36.37,15.74,"Contreras, Kelly and King",2024-03-06
437,Up-sized bandwidth-monitored throughput Campaign,Books,31.49,15.25,"Robbins, Larson and Durham",2023-11-08
438,Pre-emptive content-based open system Another,Toys,27.44,18.72,"Cox, Cook and Ortega",2024-11-20
439,Object-based intangible Graphic Interface Article,Home & Garden,25.17,10.71,Burgess-Campbell,2023-08-18
440,User-centric impactful migration Nice,Clothing,27.14,17.94,Jones-Fowler,2024-09-19
441,Self-enabling upward-trending middleware His,Automotive,24.97,9.78,"White, Martinez and Walker",2025-03-28
442,Persistent transitional interface Start,Automotive,19.27,7.25,Marquez-Johnson,2025-06-03
443,Automated contextually-based Local Area Network Yourself,Electronics,67.29,34.16,Taylor PLC,2025-08-01
444,Exclusive bottom-line interface Again,Home & Garden,7.03,4.0,Cantrell Inc,2024-01-05
445,Front-line grid-enabled application Class,Beauty,45.48,14.45,Alvarado LLC,2025-04-05
446,Team-oriented fault-tolerant Graphical User Interface Administration,Sports,38.78,15.06,"Walters, Lopez and Howell",2024-07-30
447,Object-based dedicated capacity Site,Beauty,35.12,16.94,"Moss, Bell and King",2024-03-21
448,Persistent zero tolerance approach Worker,Clothing,49.09,21.23,Wells Ltd,2024-04-20
449,Team-oriented system-worthy service-desk Happy,Home & Garden,18.65,10.91,Perez-Lambert,2025-01-09
450,Distributed even-keeled array Recent,Books,4.5,2.27,Tucker PLC,2024-08-03
451,Optimized real-time extranet Star,Home & Garden,18.96,6.9,Miller and Sons,2024-03-18
452,Visionary scalable synergy Former,Sports,9.09,5.98,Noble-Jones,2024-06-02
453,Optional exuding implementation Not,Automotive,11.18,4.66,Weaver LLC,2024-07-02
454,Operative homogeneous Local Area Network Industry,Clothing,7.43,4.4,Sanders-Glass,2024-05-15
455,Visionary scalable protocol Sign,Home & Garden,13.71,8.39,Campos LLC,2025-06-13
456,Universal eco-centric installation Positive,Toys,12.46,8.54,Fleming-Mcpherson,2025-07-09
457,Decentralized even-keeled concept Send,Beauty,3.0,1.5,Miranda Group,2024-11-11
458,Profit-focused fault-tolerant access Adult,Electronics,35.17,19.21,Williams-Nichols,2025-01-04
459,Adaptive 24/7 standardization Break,Beauty,118.66,51.49,"Jacobs, Ward and Rogers",2025-03-25
460,Extended well-modulated intranet Everyone,Clothing,32.62,18.63,Lee-Kennedy,2024-11-29
461,Ergonomic local migration Experience,Automotive,17.08,8.29,"Estrada, Gamble and Fitzpatrick",2023-12-12
462,Pre-emptive upward-trending attitude Adult,Home & Garden,19.22,9.13,Simmons Group,2024-06-01
463,Virtual methodical encoding Movement,Automotive,14.34,9.21,"Reid, Hanson and Rivera",2023-08-31
464,Enhanced content-based contingency Choice,Beauty,21.59,6.91,Andrews PLC,2024-08-30
465,Inverse uniform protocol Reveal,Home & Garden,19.5,12.73,"Griffin, Schneider and Thornton",2024-07-16
466,Quality-focused system-worthy definition Dog,Beauty,10.25,6.57,Moody Inc,2025-06-24
467,Polarized interactive time-frame Spend,Clothing,77.19,38.79,Bowman-Mcknight,2024-01-12
468,Down-sized secondary superstructure Chance,Books,6.11,3.03,Carter-Murray,2024-02-10
469,Expanded uniform encoding Exist,Automotive,35.68,15.87,Mclean-Murray,2024-08-20
470,Managed 6thgeneration budgetary management Guess,Automotive,18.52,12.92,Williams-Carrillo,2025-05-25
471,Grass-roots bottom-line leverage Minute,Beauty,91.9,31.66,Rojas-Arnold,2025-02-03
472,Open-architected holistic Local Area Network Nothing,Electronics,26.38,14.14,"Santiago, Collins and Moody",2025-04-28
473,Operative intermediate artificial intelligence And,Beauty,15.06,8.62,Campbell-Raymond,2024-02-13
474,Total solution-oriented application Also,Clothing,16.47,11.1,Mcfarland Group,2024-07-05
475,Ameliorated grid-enabled policy Before,Beauty,20.74,12.69,"Diaz, Miller and Moyer",2024-03-29
476,Decentralized multi-tasking implementation Commercial,Electronics,8.05,4.49,"Holloway, Simmons and Hernandez",2025-06-05
477,Stand-alone upward-trending flexibility Money,Toys,10.88,3.77,Williams-Miller,2025-04-10
478,Robust web-enabled encoding Price,Electronics,4.82,2.17,"Cooper, Raymond and Reyes",2024-01-21
479,Extended responsive database Fish,Clothing,9.6,3.41,Morales-Avila,2024-06-03
480,Profound static orchestration Bed,Home & Garden,21.65,14.13,"Medina, Fernandez and Short",2025-03-26
481,Horizontal analyzing capacity Indicate,Beauty,25.54,15.32,Hayes PLC,2024-02-13
482,Reverse-engineered secondary service-desk Improve,Books,4.12,2.48,Johnson PLC,2024-09-05
483,Face-to-face background functionalities Scene,Electronics,18.0,10.1,Scott-Allen,2023-11-13
484,Monitored scalable hardware Require,Toys,31.52,15.85,Henderson LLC,2024-01-05
485,Progressive actuating projection After,Electronics,17.63,6.35,"Howe, Williams and Cantrell",2023-11-02
486,Profit-focused mission-critical hub Moment,Beauty,12.1,5.23,Walters-Elliott,2024-03-31
487,Visionary global knowledgebase Get,Home & Garden,14.44,5.12,Atkins and Sons,2024-06-19
488,Cross-platform system-worthy data-warehouse Break,Automotive,13.03,7.69,Cook-Neal,2024-02-23
489,Profound well-modulated definition Simply,Beauty,12.07,4.39,"Clark, Meyer and Swanson",2023-09-28
490,Up-sized neutral challenge Writer,Automotive,23.08,13.41,Perez Inc,2024-09-08
491,Ergonomic mobile application Reduce,Toys,127.25,73.41,Perkins-Curtis,2023-10-03
492,User-centric national focus group Face,Toys,11.08,5.36,Rosales-Dixon,2025-01-02
493,Function-based human-resource monitoring Worker,Clothing,15.57,5.51,"Jennings, Shaw and Boyle",2025-06-19
494,Sharable foreground adapter Book,Books,19.27,8.21,"Thompson, Smith and Pineda",2023-10-02
495,Synchronized dedicated product Number,Beauty,11.59,4.96,Jordan-Morris,2024-12-02
496,Cross-group dynamic middleware Hit,Electronics,48.36,28.06,Porter-West,2024-04-29
497,Universal systematic framework Tonight,Electronics,3.01,1.04,"Mack, Johnson and Smith",2024-10-03
498,Customer-focused neutral function Cost,Clothing,13.13,8.29,Richard Inc,2024-01-25
499,Seamless directional complexity Interesting,Home & Garden,38.65,23.36,Williams and Sons,2025-05-04
500,User-centric even-keeled Graphic Interface Long,Beauty,15.87,5.94,Adkins Group,2023-09-03
501,Balanced asymmetric leverage Training,Sports,10.42,6.12,Sweeney-Owens,2024-03-04
502,Organized dynamic emulation Thought,Home & Garden,28.58,16.22,Romero PLC,2023-12-29
503,Pre-emptive stable alliance Audience,Electronics,41.47,24.85,Hogan-Parker,2025-04-08
504,Business-focused interactive hierarchy Data,Toys,23.77,8.93,"Ellison, Carpenter and Jones",2025-03-23
505,Open-architected 6thgeneration hardware Financial,Beauty,10.58,3.84,Ashley Ltd,2025-07-05
506,Up-sized non-volatile matrix Beautiful,Toys,28.93,11.42,Osborne-Reed,2024-10-09
507,Enterprise-wide methodical orchestration Early,Electronics,14.56,6.5,Boyer PLC,2025-08-04
508,Configurable responsive alliance None,Books,36.46,22.51,Peck-Martin,2025-07-08
509,Distributed human-resource concept Radio,Home & Garden,65.8,39.16,Chang and Sons,2024-06-17
510,Stand-alone mission-critical Local Area Network Former,Sports,2.5,1.68,Hess PLC,2024-02-02
511,Operative zero-defect superstructure Piece,Books,21.95,7.1,Ward and Sons,2023-12-11
512,Robust tertiary pricing structure So,Sports,5.01,1.53,Harris-Murphy,2024-02-20
513,Adaptive intermediate solution Age,Books,141.66,82.11,"Baird, Moore and Olson",2023-10-08
514,Innovative bifurcated middleware Leader,Home & Garden,13.81,5.69,"Marshall, Foster and Foster",2023-09-25
515,Seamless human-resource access Popular,Electronics,36.49,15.82,Bennett LLC,2024-01-02
516,Multi-lateral human-resource initiative Treat,Sports,19.53,10.13,Obrien and Sons,2024-06-26
517,Cross-platform attitude-oriented support Trade,Automotive,10.56,3.6,Moreno Inc,2024-05-22
518,Realigned contextually-based neural-net Participant,Home & Garden,9.61,5.35,"Williams, Potter and Andrade",2025-02-02
519,De-engineered background strategy Adult,Sports,71.42,30.71,Wilson Group,2024-04-22
520,Polarized foreground middleware Lawyer,Automotive,43.15,23.87,Parker-Smith,2024-09-07
521,Innovative directional hierarchy Or,Home & Garden,95.09,60.25,Phillips PLC,2024-03-23
522,Front-line 3rdgeneration paradigm Mind,Books,21.0,7.74,Baker-Wilson,2024-08-22
523,Inverse directional customer loyalty Rock,Home & Garden,25.29,17.0,"Morris, Bryant and Blake",2024-03-10
524,Multi-tiered dedicated budgetary management Everybody,Books,16.22,8.31,Davis and Sons,2025-01-29
525,Reduced client-driven middleware Professional,Electronics,15.96,10.68,Walker LLC,2024-03-31
526,Reverse-engineered incremental paradigm Between,Books,8.73,3.34,"Perez, George and Bennett",2024-11-28
527,Programmable systemic initiative Call,Clothing,21.48,11.64,Hood LLC,2024-01-20
528,Switchable methodical functionalities Radio,Electronics,10.68,4.93,Little Ltd,2024-06-20
529,Object-based needs-based Internet solution Discover,Toys,28.6,17.44,Chavez Inc,2024-06-18
530,Function-based foreground protocol Face,Toys,23.01,12.48,Rodriguez-Ramirez,2024-09-01
531,Reverse-engineered homogeneous focus group Region,Toys,25.28,12.58,"Doyle, Neal and Rice",2024-02-10
532,Synergized composite conglomeration Air,Beauty,76.72,51.03,"Castro, Ellison and Lopez",2024-04-27
533,Operative zero administration open system Vote,Automotive,19.49,8.79,"Gibson, Brennan and Lee",2023-12-07
534,Virtual object-oriented secured line Claim,Beauty,36.8,14.28,"Anderson, Rice and Johnson",2023-11-03
535,Mandatory zero-defect Graphical User Interface Newspaper,Home & Garden,103.67,56.32,"Roberts, Weber and Bridges",2024-06-23
536,Vision-oriented disintermediate application Activity,Home & Garden,57.13,31.4,Lewis-Ward,2023-08-30
537,Exclusive grid-enabled monitoring Artist,Automotive,50.53,24.03,Rios-Lucero,2024-09-25
538,Switchable tangible strategy Old,Clothing,15.72,7.78,Thomas Ltd,2024-02-25
539,Vision-oriented logistical hub Into,Home & Garden,24.14,16.51,"Lambert, Knight and Miller",2024-04-05
540,Self-enabling dynamic extranet Size,Electronics,7.0,4.15,"Vargas, Lawrence and Anderson",2023-09-22
541,Implemented reciprocal attitude Serve,Electronics,29.94,10.31,Dyer LLC,2023-12-25
542,Balanced motivating model Happen,Toys,25.02,9.63,"Diaz, Acevedo and Miller",2025-07-26
543,Focused explicit open architecture Who,Books,20.46,14.12,"Hughes, Nelson and Cross",2025-05-26
544,Quality-focused disintermediate artificial intelligence Wall,Sports,45.68,26.98,Rogers PLC,2024-09-15
545,Robust web-enabled contingency Let,Home & Garden,7.64,5.09,Arellano-Ward,2024-11-19
546,Up-sized cohesive knowledge user Through,Clothing,74.28,31.31,"Matthews, Garcia and Edwards",2024-08-06
547,Organic motivating toolset Determine,Toys,41.32,24.66,Smith Inc,2025-05-04
548,Horizontal actuating methodology Pass,Automotive,18.98,11.11,"Juarez, Gordon and Wade",2024-03-21
