product_id,product_name,category,price,cost,supplier,launch_date
1,Fundamental multimedia implementation Ground,Automotive,78.73,35.83,"Lee, Smith and Curtis",2024-05-03
2,Persevering encompassing customer loyalty Agent,Clothing,41.82,16.56,Andrews-Jones,2025-06-13
3,Open-architected coherent adapter Idea,Automotive,31.13,13.98,Adams-Terry,2024-10-10
4,Progressive asymmetric function Require,Automotive,35.89,12.36,Soto-Andrade,2023-10-21
5,Synergistic next generation productivity Fire,Books,63.56,43.76,Doyle-Reilly,2024-10-05
6,Re-contextualized reciprocal product Candidate,Automotive,47.49,25.15,"Bennett, Cooper and Jenkins",2024-02-11
7,Reverse-engineered motivating standardization Leg,Automotive,31.61,11.1,Garcia Inc,2024-05-10
8,Digitized actuating conglomeration Threat,Automotive,47.22,20.83,"Taylor, Perez and Hester",2023-09-16
9,Reverse-engineered multimedia artificial intelligence At,Beauty,8.45,4.38,"Mata, Holt and Martinez",2024-12-26
10,Expanded 24/7 task-force Above,Home & Garden,6.04,3.1,Peterson-Cooper,2023-09-22
11,Programmable encompassing encoding Win,Electronics,22.78,7.16,"Griffith, Thompson and Vang",2024-01-08
12,Stand-alone didactic paradigm Call,Toys,21.22,14.44,Donovan and Sons,2023-12-08
13,Implemented attitude-oriented paradigm Season,Automotive,13.0,5.33,Spence-Anderson,2024-10-26
14,Reactive bifurcated system engine Bag,Automotive,38.89,11.92,Davis-Esparza,2024-08-19
15,Total scalable intranet Perhaps,Sports,4.53,1.5,Perez-Robinson,2025-03-19
16,Open-source dynamic core Against,Toys,13.09,6.96,"Lee, Lloyd and Blanchard",2024-03-12
17,Self-enabling global ability Look,Beauty,13.63,4.84,Moon-Shepherd,2023-08-27
18,Versatile even-keeled orchestration Group,Clothing,5.42,1.72,"Oliver, Sims and Moore",2025-01-20
19,Business-focused executive forecast Edge,Electronics,66.41,30.01,Jones LLC,2024-10-03
20,Down-sized leadingedge attitude That,Toys,6.77,3.72,Benjamin PLC,2024-11-19
21,Reverse-engineered composite orchestration Open,Clothing,12.55,4.33,Ramos Inc,2024-09-02
22,Streamlined 24hour circuit Seat,Books,41.53,17.66,"Velazquez, Lane and Swanson",2024-06-01
23,Programmable even-keeled projection Everything,Sports,33.68,15.73,Cain-Patterson,2024-12-31
24,Virtual bifurcated utilization Step,Sports,8.28,3.01,Martinez-Walters,2024-08-31
25,Open-source background service-desk Huge,Books,34.67,17.42,"Hale, Wilson and Mejia",2025-02-14
26,Reverse-engineered didactic software Issue,Clothing,25.33,8.46,Mora-Conley,2024-09-22
27,Enhanced encompassing approach Nature,Toys,129.86,41.37,Jones Inc,2025-03-01
28,User-centric multi-tasking throughput Give,Electronics,27.75,14.1,Salazar Inc,2024-03-07
29,Customizable solution-oriented projection Later,Clothing,17.94,7.16,Sosa LLC,2025-06-23
30,Focused clear-thinking encoding Move,Electronics,10.12,3.42,Johnson-Hoover,2023-12-01
31,Customer-focused dedicated matrix Address,Beauty,11.07,5.2,Wong Inc,2025-07-28
32,User-centric foreground matrices Seem,Automotive,10.37,6.91,Richards-Clayton,2024-02-11
33,Synchronized explicit archive Always,Books,60.15,35.47,Nichols-Morales,2024-05-13
34,Fully-configurable methodical installation Within,Home & Garden,20.38,12.76,Davis-Gonzalez,2023-10-19
35,Diverse context-sensitive instruction set Tonight,Electronics,31.57,20.48,"Howard, Kennedy and Chen",2024-12-17
36,Upgradable full-range policy Executive,Sports,67.45,46.48,Stevens Ltd,2024-10-26
37,Decentralized transitional Graphic Interface Career,Automotive,3.04,1.84,"Hall, Berry and White",2025-08-14
38,Multi-lateral national database New,Beauty,55.87,30.36,"Smith, Peterson and Lewis",2025-01-22
39,Monitored attitude-oriented website Lawyer,Sports,21.0,9.37,Adams-Stephens,2023-09-16
40,Focused foreground methodology Nation,Beauty,28.45,10.6,Vasquez Group,2025-02-17
41,Compatible bottom-line installation Fear,Sports,10.35,5.95,"Montoya, Page and Kelly",2025-05-26
42,Vision-oriented even-keeled structure Leader,Clothing,10.98,7.66,Bauer-Edwards,2023-12-20
43,Open-source motivating focus group Sure,Toys,29.7,14.46,Armstrong PLC,2025-05-03
44,Polarized bi-directional core Conference,Clothing,135.32,79.77,Spencer Inc,2024-07-19
45,Synergized regional approach Structure,Clothing,44.82,22.32,Henderson-Farmer,2024-04-15
46,Cross-platform zero-defect approach Very,Toys,55.28,26.13,Russo LLC,2024-01-05
47,Enhanced real-time projection Blood,Beauty,17.23,8.0,Sutton-Green,2023-11-11
48,Mandatory multi-state throughput Town,Beauty,12.43,6.24,Perkins-Becker,2024-12-23
49,Synergistic global software Camera,Toys,10.75,4.8,Avery Group,2024-04-08
50,Cross-platform neutral hub Never,Sports,13.59,8.15,Acosta LLC,2024-11-14
51,Configurable bottom-line application Between,Electronics,3.89,2.53,"Drake, Stephens and Fry",2023-12-04
52,Horizontal human-resource analyzer Catch,Beauty,11.25,7.35,"Moore, Martin and Day",2025-06-25
53,Ergonomic zero administration synergy Hospital,Sports,12.83,5.02,Shelton-Walters,2024-10-04
54,Fully-configurable global productivity Stock,Electronics,17.46,11.5,Ramirez-Mccormick,2025-02-18
55,Reverse-engineered hybrid migration Commercial,Toys,22.32,9.75,"Hogan, Herrera and Fox",2024-09-17
56,Profound optimizing access Bill,Clothing,26.84,11.37,"Foster, Harvey and Wiggins",2024-04-04
57,Future-proofed actuating monitoring Build,Beauty,19.85,11.73,Turner-Murphy,2023-10-13
58,Devolved system-worthy encryption Great,Home & Garden,12.61,5.32,"Baker, Wilson and Richardson",2024-06-14
59,Optimized discrete workforce Beat,Clothing,4.18,1.34,Oliver PLC,2025-02-28
60,Open-architected modular implementation Indicate,Books,12.68,5.7,Scott Group,2024-02-14
61,Business-focused client-server knowledge user Beyond,Electronics,9.23,5.43,"Brown, Brown and Harris",2025-08-17
62,Object-based next generation paradigm Couple,Home & Garden,29.16,12.56,"Miller, Young and Nichols",2025-07-10
63,Persistent multi-tasking productivity One,Clothing,41.57,22.94,Powell-Campbell,2025-02-19
64,Realigned even-keeled Local Area Network Music,Automotive,42.56,24.01,Wilson-Miranda,2024-03-21
65,Visionary systemic utilization Machine,Beauty,36.8,21.84,Quinn LLC,2025-06-27
66,Cross-group needs-based archive Too,Home & Garden,18.05,11.89,Baker-Singh,2024-03-26
67,Seamless dedicated monitoring Drug,Sports,13.23,6.26,"Knapp, Kemp and Ramsey",2024-09-02
68,Integrated modular secured line Water,Electronics,11.05,4.05,Huff Group,2024-08-15
69,Organic value-added analyzer Happen,Books,6.01,2.57,Combs Inc,2025-01-03
70,Cross-group 24/7 project Television,Sports,44.41,21.0,Bauer-Alexander,2024-11-19
71,Virtual user-facing structure Especially,Automotive,17.47,10.23,"Robinson, Acevedo and Estes",2025-08-09
72,Phased discrete ability Product,Home & Garden,7.41,2.26,Hoffman-Allen,2024-01-10
73,Realigned 4thgeneration contingency Nation,Clothing,10.37,4.42,"Carr, Lewis and Ross",2024-08-28
74,Down-sized bandwidth-monitored data-warehouse Build,Electronics,10.04,6.14,Martin-Klein,2024-12-29
75,Triple-buffered attitude-oriented standardization Fire,Beauty,20.79,11.82,Schmitt-Gould,2024-12-12
76,Profound context-sensitive function Professional,Books,47.18,27.96,"Wilson, Greene and Hodges",2024-07-06
77,Cross-group user-facing framework Sing,Clothing,15.2,9.5,"Perkins, Lee and Cantu",2024-12-05
78,Focused 3rdgeneration focus group Soon,Books,3.31,2.03,"Donovan, Elliott and Miller",2025-04-20
79,Implemented fault-tolerant implementation Our,Beauty,17.26,9.89,"Clark, Hull and Flores",2025-05-30
80,Persistent national product Per,Toys,17.73,8.44,Young-Mason,2025-05-10
81,Implemented client-server utilization Generation,Electronics,16.78,11.64,"Little, Morris and Smith",2025-03-17
82,Re-contextualized incremental definition First,Home & Garden,12.16,6.42,Myers Inc,2025-06-09
83,Reduced web-enabled adapter Soon,Books,23.9,9.11,Davis-Miller,2024-01-19
84,Ameliorated background parallelism Live,Electronics,21.18,8.83,Anderson-Costa,2024-12-09
85,Operative multi-tasking success Show,Books,19.69,11.37,Foster-Baird,2025-01-20
86,Robust directional encryption Factor,Clothing,27.94,18.72,Martin-Harrison,2025-06-14
87,Multi-lateral 24hour approach Evening,Books,14.24,5.29,"Molina, Howe and Leonard",2025-05-15
88,Customer-focused regional hierarchy Behind,Toys,13.61,4.53,"Thompson, Hall and Wagner",2023-12-13
89,Synchronized background customer loyalty Professional,Clothing,60.59,39.54,Mullen LLC,2023-08-22
90,Balanced didactic algorithm Level,Clothing,31.42,20.93,Wiggins-Ortiz,2024-05-12
91,Vision-oriented human-resource info-mediaries Avoid,Electronics,38.92,15.98,Miller-Singleton,2024-05-30
92,Polarized 24hour info-mediaries Scientist,Sports,53.56,24.15,Watkins-Chavez,2025-05-22
93,Customer-focused human-resource software Several,Beauty,30.59,17.26,Santos Inc,2023-10-19
94,Open-architected next generation superstructure Executive,Books,42.21,18.23,Green-Brady,2025-05-28
95,Open-source fault-tolerant utilization Road,Home & Garden,5.68,3.7,Stephens LLC,2025-04-30
96,Public-key systematic challenge Style,Automotive,23.65,8.11,Campbell-Marsh,2024-05-28
97,Stand-alone 4thgeneration policy Nearly,Clothing,17.35,5.47,Martinez and Sons,2025-03-15
98,Pre-emptive clear-thinking moderator For,Sports,76.87,29.47,Jones PLC,2025-01-03
99,Visionary multi-state archive Music,Clothing,42.19,17.49,"Marsh, Holland and Shaw",2024-08-13
100,Customer-focused national info-mediaries Painting,Sports,12.13,4.19,"Garcia, Miller and Stanton",2023-08-22
101,Object-based real-time challenge Draw,Sports,27.06,8.83,Liu-Sanchez,2025-04-22
102,Vision-oriented even-keeled extranet Watch,Home & Garden,22.97,13.83,"Berry, Williamson and Young",2024-02-28
103,Function-based analyzing Graphic Interface Hope,Sports,28.89,10.57,"Miles, Valdez and Lopez",2025-05-10
104,Organic client-server function Moment,Home & Garden,8.89,5.92,"Williams, Love and Livingston",2024-05-19
105,Versatile maximized concept Beautiful,Electronics,26.79,11.98,Pacheco Group,2025-06-21
106,Face-to-face zero-defect orchestration It,Clothing,16.73,9.51,Sexton-Vargas,2025-02-24
107,Exclusive solution-oriented initiative Claim,Home & Garden,25.18,9.82,Wilkins Ltd,2024-01-11
108,Assimilated tertiary paradigm Bad,Beauty,11.25,4.46,Harrell-Harris,2025-03-12
109,Open-source 24hour protocol Explain,Toys,12.58,6.67,"Moore, Martin and Zimmerman",2025-03-14
110,Reduced systematic frame Break,Clothing,51.37,26.93,Roberts-Sutton,2024-02-13
111,Polarized user-facing standardization Coach,Toys,8.66,5.26,Wade PLC,2023-08-26
112,Ergonomic asymmetric process improvement Air,Beauty,9.19,5.54,"Castillo, Walker and Vazquez",2024-03-29
113,Cloned leadingedge approach Say,Books,19.27,10.95,Carpenter-Ortiz,2024-02-04
114,Networked interactive moderator Will,Beauty,10.83,5.19,Wade-Harper,2024-02-28
115,Multi-tiered dynamic intranet Center,Electronics,9.89,6.49,"Smith, Wilson and Davis",2024-12-14
116,Cross-platform tangible moratorium Student,Books,21.85,12.0,Cook-Lopez,2024-03-16
117,Multi-lateral zero tolerance open architecture Parent,Books,6.03,4.2,Martin and Sons,2024-10-22
118,Extended grid-enabled migration Yeah,Sports,8.97,5.63,Cohen-Gonzalez,2023-11-12
119,Function-based upward-trending success Win,Beauty,103.88,33.01,"Green, Jordan and Walker",2024-05-24
120,Versatile solution-oriented application Surface,Automotive,29.01,12.42,Simmons Ltd,2025-07-20
121,Integrated mission-critical analyzer Start,Sports,11.05,5.84,Sexton-Evans,2024-10-31
122,Multi-lateral system-worthy knowledgebase Behavior,Beauty,28.07,16.52,Clark Inc,2024-10-27
123,Diverse intangible functionalities Important,Books,31.62,16.45,Robertson-White,2025-07-30
124,Monitored human-resource solution Fall,Automotive,44.5,27.34,Harvey LLC,2024-09-18
125,Cross-platform systemic interface Four,Sports,18.14,7.49,Farley-Fischer,2025-05-23
126,Object-based human-resource instruction set Lot,Toys,43.87,16.39,White-Preston,2023-12-07
127,Cross-platform full-range knowledgebase Spring,Clothing,3.93,1.26,Brooks-Hooper,2025-02-04
128,Customizable attitude-oriented capability Challenge,Automotive,8.63,4.57,Garcia Ltd,2024-06-15
129,Automated modular adapter Book,Beauty,22.9,13.18,"Banks, Maxwell and Eaton",2024-09-22
130,Programmable system-worthy protocol Affect,Beauty,26.15,11.26,Suarez-Bell,2024-08-17
131,Team-oriented global product New,Sports,9.68,5.28,Moore PLC,2024-04-01
132,Visionary non-volatile core Southern,Beauty,24.72,7.93,Lindsey-Smith,2024-03-31
133,Multi-layered non-volatile interface Military,Books,12.19,4.14,"Velasquez, Acosta and Brown",2024-02-05
134,Self-enabling optimizing workforce Cultural,Sports,16.09,9.34,Hernandez PLC,2024-02-19
135,Open-source contextually-based hierarchy Set,Sports,45.6,20.39,"Campbell, Lane and Gonzalez",2025-01-21
136,Mandatory client-driven hardware Magazine,Automotive,41.56,23.63,"Hernandez, Daniel and Patel",2024-09-03
137,Operative attitude-oriented hardware Ahead,Home & Garden,9.05,5.73,"Simon, Joseph and Walter",2025-07-22
138,Universal transitional encoding Cup,Toys,8.62,5.53,"Lane, Smith and Johnson",2024-01-25
139,Monitored real-time website Production,Toys,14.46,5.33,"Gregory, Shepard and Small",2023-11-12
140,Profound secondary firmware North,Home & Garden,19.66,9.72,"White, Cooper and Friedman",2024-03-09
141,Business-focused multi-state instruction set Attorney,Automotive,11.87,7.05,"Gonzalez, Edwards and Keller",2024-12-19
142,Profit-focused intermediate service-desk Soon,Books,46.18,28.15,"Forbes, Garcia and Scott",2025-08-05
143,Synchronized system-worthy productivity Name,Clothing,26.52,16.28,Reynolds and Sons,2023-08-26
144,User-centric content-based system engine Action,Beauty,27.8,10.88,"Wallace, Stevens and Martin",2023-12-06
145,Function-based demand-driven focus group Check,Automotive,7.29,2.75,Thornton-Kemp,2024-12-03
146,Diverse optimizing portal Two,Electronics,51.1,27.39,Golden Ltd,2023-09-03
147,Synchronized modular moratorium Hour,Beauty,2.1,1.25,"Dickerson, Brown and Santos",2024-02-10
148,Extended clear-thinking capability Rock,Electronics,39.14,16.74,Lara-Smith,2023-09-02
149,Team-oriented 24hour architecture Seem,Automotive,42.41,14.5,Hudson-Forbes,2023-09-26
150,Front-line directional paradigm Off,Toys,14.21,8.34,"Browning, Wells and Hoffman",2024-10-14
151,Re-contextualized didactic access Other,Books,55.61,23.35,Williams LLC,2023-11-08
152,Advanced even-keeled ability Anyone,Clothing,19.1,7.0,"Wood, Garcia and Bailey",2025-04-23
153,Fully-configurable mobile instruction set Guy,Clothing,21.11,7.58,"Johnson, Howard and Baker",2025-02-01
154,Reactive fault-tolerant support Wide,Clothing,26.35,11.22,Hawkins-West,2025-04-27
155,Switchable non-volatile protocol There,Home & Garden,257.05,138.05,Schultz-Parker,2023-08-23
156,Ameliorated bi-directional framework And,Books,58.88,26.11,Porter-Garcia,2024-02-06
157,Mandatory intermediate groupware Simply,Electronics,35.2,10.85,Frazier PLC,2024-12-01
158,Adaptive client-server help-desk Listen,Clothing,9.68,3.28,Freeman-Ray,2023-10-27
159,Reactive mobile alliance Remember,Books,22.53,9.38,Boone-Jones,2023-10-11
160,User-centric radical analyzer Popular,Beauty,10.48,5.91,"Pugh, Bishop and Greer",2023-11-16
161,Inverse reciprocal approach Character,Electronics,38.77,13.16,Vargas Ltd,2024-12-29
162,Synergized maximized support Play,Toys,22.47,11.78,Bryant PLC,2024-04-06
163,Re-contextualized 24hour flexibility Include,Home & Garden,8.17,2.84,Fuller Group,2023-08-27
164,Ergonomic hybrid portal Town,Sports,21.43,8.24,"Mills, Craig and Parker",2024-09-02
165,Cloned zero-defect policy Source,Automotive,10.18,3.76,Bradford-Norris,2024-05-11
166,Re-engineered bifurcated model Southern,Automotive,22.67,7.41,Smith PLC,2024-06-03
167,Ergonomic zero administration model Kitchen,Electronics,10.1,5.74,"Levine, Perkins and Ruiz",2024-11-03
168,Future-proofed multi-tasking system engine Now,Toys,20.53,9.96,"Carlson, Torres and Mckee",2024-08-15
169,Ergonomic homogeneous challenge Issue,Toys,36.61,23.15,"Mcknight, Ray and Wang",2024-10-08
170,Reverse-engineered intangible artificial intelligence Itself,Toys,19.25,6.54,"Turner, Mcdonald and Blackburn",2025-04-24
171,Total content-based info-mediaries Light,Beauty,14.69,5.26,Henry-Wilkinson,2024-07-22
172,Synchronized methodical architecture Lose,Electronics,23.63,9.99,Garcia-Rogers,2023-12-26
173,Triple-buffered logistical functionalities Crime,Electronics,35.08,21.27,Ramirez-Russell,2023-10-12
174,Right-sized incremental structure Wind,Sports,8.28,3.5,Hines-Alexander,2025-06-09
175,Synergized object-oriented strategy Firm,Clothing,24.74,11.46,Wilcox-Harris,2024-07-06
176,Synergistic zero tolerance contingency Risk,Beauty,57.63,24.24,Garcia-Phillips,2025-07-21
177,Networked regional attitude Help,Toys,31.78,10.55,Jones-Lucero,2024-01-31
178,Future-proofed tertiary moratorium Project,Sports,21.04,14.22,Davis Group,2024-03-01
179,Seamless maximized moratorium Off,Electronics,33.51,17.41,"Wood, Cochran and Ewing",2024-09-13
180,Upgradable background secured line Provide,Beauty,28.85,17.75,Collins Group,2024-04-11
181,Fundamental bandwidth-monitored solution Certainly,Home & Garden,36.7,20.67,Jordan Group,2025-03-14
182,Fundamental fresh-thinking complexity Stuff,Electronics,3.98,2.01,Henry-Martin,2025-03-11
183,Organic web-enabled leverage Also,Home & Garden,5.8,1.95,Little-Nelson,2024-03-28
184,Multi-lateral 5thgeneration utilization None,Books,44.87,25.0,"Harris, Nguyen and Smith",2024-02-15
185,Phased global Graphical User Interface Amount,Home & Garden,6.02,2.18,Johnson Ltd,2025-08-16
186,Inverse intermediate complexity Evidence,Electronics,27.69,12.9,"Mills, Steele and Glover",2023-10-03
187,Implemented national artificial intelligence Of,Sports,15.16,8.36,"Estrada, Jones and Jones",2024-05-03
188,User-friendly value-added success Not,Electronics,9.05,5.55,Davis and Sons,2024-01-30
189,Public-key stable info-mediaries Letter,Electronics,26.57,15.25,Drake Ltd,2024-04-07
190,Programmable optimizing structure Hold,Books,23.59,13.41,Burnett-Mcdonald,2025-08-06
191,Assimilated bandwidth-monitored definition Very,Toys,108.67,39.08,"Castro, Carney and Parks",2024-03-07
192,Re-engineered bifurcated orchestration Deep,Clothing,12.18,5.34,"Graham, Mcknight and Kane",2025-08-10
193,Progressive maximized approach Left,Electronics,63.57,20.16,Mercado-Lopez,2025-03-24
194,Grass-roots transitional artificial intelligence Fire,Books,26.63,15.65,"Brown, Stevenson and Thompson",2024-12-22
195,Down-sized 3rdgeneration attitude Effect,Sports,11.84,8.06,Lara-Ryan,2025-07-19
196,Grass-roots regional protocol Strategy,Books,38.07,15.44,Foley-Woods,2024-08-23
197,Public-key fault-tolerant data-warehouse Old,Automotive,31.58,10.58,Hicks Inc,2024-05-05
198,User-friendly context-sensitive moratorium Record,Books,20.67,10.13,"Jimenez, Richards and Murray",2025-07-11
199,Virtual asynchronous function Adult,Home & Garden,24.85,15.97,"Buchanan, West and Oconnor",2024-05-19
200,Implemented human-resource conglomeration Forget,Clothing,12.46,6.49,Benson-Martin,2023-09-03
201,Phased national Internet solution Right,Clothing,10.37,3.31,White-Collins,2025-04-24
202,Upgradable dedicated utilization Help,Beauty,36.88,25.44,Brown-Jackson,2024-09-20
203,Organic web-enabled contingency Dinner,Toys,16.79,10.6,"Humphrey, Soto and Colon",2023-12-10
204,Open-source stable complexity Meet,Sports,18.84,6.64,"Carter, Sullivan and Obrien",2025-07-13
205,Focused discrete application More,Beauty,25.12,16.8,Weeks Inc,2024-02-12
206,Switchable object-oriented access Effort,Toys,24.83,11.93,Hampton-Thompson,2024-10-21
207,Integrated foreground time-frame Fine,Toys,6.4,2.87,Hernandez-Bowers,2023-12-09
208,Integrated hybrid projection Month,Books,56.2,27.22,Haynes Ltd,2024-10-01
209,Horizontal dynamic task-force Could,Sports,22.13,14.03,"Wong, Bray and Hicks",2024-12-23
210,Cloned value-added analyzer Tree,Toys,17.08,9.63,Mcmahon-Allen,2024-10-05
211,Right-sized fresh-thinking frame Plant,Sports,28.35,9.18,Fischer-Hill,2024-10-24
212,Networked next generation instruction set Blue,Clothing,24.27,16.58,Perkins LLC,2023-11-01
213,Pre-emptive logistical website Serious,Clothing,37.1,13.32,Dunn PLC,2025-08-04
214,Synchronized content-based approach Station,Clothing,30.89,18.48,"Smith, Harris and Palmer",2024-06-19
215,Phased non-volatile ability Page,Electronics,35.67,19.78,Price-Vincent,2023-10-19
216,Secured asynchronous solution Truth,Books,59.19,22.2,"Williams, Taylor and Turner",2024-02-14
217,Up-sized object-oriented pricing structure Put,Automotive,40.73,15.0,Mahoney and Sons,2024-08-07
218,Sharable solution-oriented utilization Threat,Sports,17.67,11.45,Holmes-Barnes,2025-01-06
219,Profit-focused even-keeled infrastructure Like,Books,8.18,3.83,Hopkins PLC,2023-10-23
220,Operative asymmetric Local Area Network After,Toys,76.27,42.85,"Odonnell, Williamson and Phillips",2024-11-11
221,Right-sized object-oriented hub Buy,Sports,16.61,8.33,"Hutchinson, Keith and Aguirre",2025-07-05
222,Cross-group web-enabled analyzer Dinner,Sports,13.76,8.13,Greene-Baker,2024-04-28
223,Universal grid-enabled initiative Shoulder,Beauty,5.01,2.46,Nguyen-Reed,2025-01-30
224,Diverse foreground matrices Room,Sports,26.33,10.93,Schultz-Jackson,2024-09-21
225,Object-based client-driven architecture Art,Sports,22.63,10.08,"Smith, Malone and Smith",2024-10-06
226,Up-sized responsive policy Along,Home & Garden,5.98,3.85,"Townsend, Shields and Wright",2025-06-13
227,Digitized multi-tasking algorithm Half,Automotive,28.86,14.06,"Thomas, Rubio and Smith",2025-04-09
228,Persevering well-modulated parallelism Scientist,Home & Garden,13.48,5.19,"Fields, Wheeler and Herrera",2023-09-09
229,Mandatory holistic adapter Agent,Beauty,172.82,116.45,Little-Cross,2024-09-02
230,Centralized well-modulated extranet Finish,Electronics,12.74,7.88,"Taylor, Adams and Edwards",2024-02-09
231,Grass-roots asynchronous hardware Last,Clothing,14.18,4.57,Harris-Lynch,2025-04-23
232,Visionary homogeneous software Economy,Toys,9.98,6.98,White and Sons,2025-05-23
233,Balanced holistic superstructure List,Toys,55.83,32.27,Anderson PLC,2025-05-14
234,Diverse modular hub Leader,Automotive,14.91,5.43,Ross Inc,2023-12-07
235,Distributed contextually-based adapter Common,Sports,11.25,4.44,Norton LLC,2025-07-24
236,Customizable local functionalities Now,Books,35.36,20.4,"Fuentes, Ayala and Stein",2024-08-28
237,Re-contextualized context-sensitive open architecture Difference,Toys,6.66,4.08,"Kemp, Perez and Simpson",2023-11-20
238,Re-contextualized tangible adapter Full,Home & Garden,33.12,13.1,Torres and Sons,2024-04-12
239,Ergonomic logistical algorithm Buy,Clothing,83.52,33.64,Jones-Hammond,2024-06-08
240,User-friendly discrete project Mean,Electronics,31.6,13.36,Atkinson-Black,2024-02-07
241,Triple-buffered hybrid standardization Sit,Clothing,33.46,18.04,"Warren, Newman and Miller",2024-05-14
242,Assimilated static knowledgebase Crime,Sports,40.29,14.86,"Silva, Larson and Weaver",2024-05-10
243,Adaptive static data-warehouse Claim,Automotive,78.87,26.95,"Jackson, Santiago and Lewis",2024-04-02
244,Upgradable even-keeled model Political,Clothing,52.87,30.22,Martinez PLC,2023-12-06
245,Ergonomic zero-defect circuit Dream,Sports,28.55,17.46,"Turner, Webster and Downs",2024-10-05
246,Stand-alone maximized matrices Whom,Beauty,41.39,20.71,Guzman PLC,2024-04-11
247,Multi-lateral intangible matrix Maybe,Home & Garden,9.89,4.41,Miller-Romero,2024-07-20
248,Seamless encompassing implementation Important,Home & Garden,37.38,17.67,Miranda Group,2025-05-11
249,Quality-focused fresh-thinking database Then,Sports,8.98,4.09,Thomas Inc,2024-09-24
250,Enterprise-wide even-keeled budgetary management Sound,Books,14.97,10.24,Day Group,2025-05-13
251,Implemented motivating forecast Clearly,Home & Garden,1.71,1.04,"Stewart, Landry and Foley",2024-07-04
252,Operative solution-oriented open architecture Pm,Automotive,27.69,10.61,Maxwell LLC,2024-01-31
253,Profound neutral superstructure Also,Books,12.0,5.44,"Howard, Turner and Griffin",2025-03-31
254,Pre-emptive leadingedge help-desk Maybe,Sports,48.86,25.29,Woods Ltd,2025-07-26
255,Sharable executive Internet solution Student,Beauty,27.44,14.96,Marks PLC,2024-12-20
256,Monitored multi-tasking Graphical User Interface Require,Sports,49.37,24.06,"Hull, Walsh and Ritter",2025-02-22
257,User-friendly leadingedge neural-net Hot,Beauty,8.44,5.27,Barton-Martin,2025-07-23
258,Object-based exuding hierarchy Begin,Toys,46.1,27.98,Sandoval PLC,2025-04-11
259,Vision-oriented tangible paradigm Country,Home & Garden,108.28,54.36,"Dalton, Gonzalez and Robinson",2025-05-21
260,Grass-roots client-driven knowledge user Out,Automotive,37.02,23.76,Robertson-Shaffer,2024-10-12
261,Front-line empowering info-mediaries Nothing,Books,37.8,22.7,"Williams, Lewis and Good",2024-07-27
262,Synergized clear-thinking projection Practice,Automotive,23.0,14.06,Bradford-Thomas,2024-01-02
263,Synchronized next generation hierarchy Benefit,Sports,13.2,9.01,Walton Inc,2023-09-27
264,Open-architected grid-enabled circuit Cover,Toys,36.93,15.02,Hopkins-Rivas,2024-01-27
265,Synchronized multi-state matrix Value,Home & Garden,6.02,2.45,"Wright, Fowler and Gibson",2025-06-20
266,Expanded fresh-thinking benchmark Before,Automotive,14.38,9.43,Friedman Ltd,2023-12-25
267,Reactive maximized matrices Nice,Toys,4.87,2.97,"Reyes, Hodges and Best",2024-01-19
268,Object-based disintermediate firmware Product,Beauty,11.44,7.67,Perkins-Alexander,2024-09-28
269,Cloned even-keeled forecast Opportunity,Sports,33.57,10.92,Friedman-Acosta,2024-02-07
270,Polarized static matrix Let,Toys,30.09,16.58,"Stewart, Pittman and Perez",2025-04-02
271,Innovative leadingedge installation Star,Automotive,20.92,7.49,Forbes-Mason,2023-12-16
272,Exclusive optimal knowledge user Reason,Toys,23.02,11.55,Cannon-Lawrence,2025-03-24
273,Up-sized asynchronous adapter Data,Beauty,4.44,1.61,Lopez PLC,2023-11-24
274,Cloned multi-tasking monitoring Leg,Clothing,14.91,5.24,"Conrad, Goodman and Rocha",2024-08-25
275,Vision-oriented context-sensitive methodology Message,Automotive,11.65,3.55,Harrington-Brown,2023-10-04
