product_id,product_name,category,price,cost,supplier,launch_date
549,Synergized responsive workforce Cup,Beauty,17.83,7.45,Welch Inc,2025-04-15
550,Devolved motivating artificial intelligence Wrong,Automotive,29.5,15.35,Hood Ltd,2023-08-20
551,Realigned background info-mediaries Recognize,Electronics,67.81,37.36,Johnson-Roberts,2024-12-09
552,Phased background matrix Live,Electronics,21.79,10.73,Jones Inc,2024-01-29
553,Synchronized bandwidth-monitored capability According,Electronics,22.54,14.22,Johnson Group,2025-04-02
554,Face-to-face executive analyzer Contain,Sports,20.38,12.9,"Washington, Ruiz and Thomas",2025-05-30
555,Business-focused mobile definition Leave,Sports,83.56,53.5,Hurst PLC,2025-01-31
556,Cloned modular function Front,Home & Garden,14.95,9.29,Arnold-Edwards,2024-11-14
557,Persevering web-enabled firmware Born,Beauty,19.62,9.72,Reed LLC,2024-01-23
558,Phased responsive pricing structure Attorney,Clothing,64.76,29.31,"Hamilton, Bush and Reyes",2024-03-12
559,Profit-focused encompassing productivity Newspaper,Sports,22.59,14.29,White PLC,2025-07-24
560,Adaptive 3rdgeneration utilization Assume,Automotive,49.88,24.74,Cisneros Ltd,2024-12-06
561,Assimilated web-enabled access Under,Books,9.69,3.86,Roman-Campbell,2025-02-04
562,Cross-group discrete encoding Artist,Sports,17.04,8.57,Stevens Inc,2025-06-28
563,Synergized scalable concept Set,Electronics,65.86,23.49,Richmond-Reyes,2025-02-02
564,Decentralized even-keeled neural-net Per,Automotive,11.69,6.74,Burke and Sons,2024-06-16
565,Ameliorated eco-centric access Base,Clothing,17.8,7.73,"Robinson, Dillon and Newman",2024-03-22
566,Cross-group upward-trending encryption They,Home & Garden,24.66,9.97,"Houston, Owens and Smith",2024-08-21
567,Visionary secondary orchestration Color,Sports,9.1,6.21,King-Black,2025-05-04
568,Customer-focused heuristic protocol Provide,Electronics,14.42,8.81,Thomas-Allen,2025-04-21
569,Realigned uniform archive Partner,Toys,21.98,13.51,"Richmond, Esparza and Chang",2024-11-25
570,Distributed maximized throughput Million,Books,20.85,11.46,Arroyo Ltd,2025-08-14
571,Digitized encompassing forecast Enjoy,Books,55.94,35.56,"Estrada, Keller and Cook",2024-01-17
572,Stand-alone local strategy Kitchen,Toys,68.94,41.62,Walter-Reid,2024-05-26
573,Horizontal fresh-thinking implementation Bag,Home & Garden,10.13,5.47,Torres Group,2024-02-04
574,Programmable upward-trending support Us,Home & Garden,21.96,15.03,Williams PLC,2024-12-12
575,Integrated interactive open architecture Painting,Sports,34.45,12.98,Wolfe Ltd,2025-02-20
576,Cross-platform holistic solution Prove,Home & Garden,67.56,45.76,Myers-Murray,2025-05-07
577,Quality-focused value-added customer loyalty Design,Automotive,35.69,16.44,Rich LLC,2025-06-21
578,Object-based full-range process improvement Soon,Beauty,25.35,12.96,Lewis-Moore,2024-05-04
579,Organic fault-tolerant matrix Usually,Beauty,34.23,11.95,"Parker, Hansen and Moore",2025-06-22
580,Balanced responsive parallelism Body,Electronics,34.43,17.77,Farmer-Martin,2024-06-15
581,Implemented multimedia Local Area Network Site,Electronics,9.56,5.21,Rogers Group,2023-12-23
582,Team-oriented bottom-line portal Crime,Automotive,23.44,16.39,Torres and Sons,2025-04-30
583,Total systematic portal Some,Electronics,64.54,44.54,Young-Francis,2023-11-07
584,Advanced multimedia toolset Door,Beauty,17.02,11.69,"Taylor, Sampson and Vincent",2025-03-16
585,Face-to-face multi-state capacity Threat,Sports,22.28,9.79,Green Group,2024-04-26
586,User-friendly homogeneous hardware Knowledge,Sports,16.54,11.52,Coleman-Cox,2024-03-31
587,Decentralized non-volatile leverage Nor,Home & Garden,3.15,1.52,Wright Inc,2023-12-12
588,Sharable zero-defect paradigm Human,Sports,20.42,13.08,"Levine, Singh and Nolan",2025-02-15
589,Quality-focused asynchronous challenge Huge,Electronics,25.57,9.88,Weaver Ltd,2025-05-02
590,Open-architected incremental software Practice,Clothing,13.33,6.7,Brown PLC,2024-07-06
591,Reduced bottom-line info-mediaries Show,Electronics,7.97,5.47,Garcia-Williams,2023-11-29
592,Re-engineered non-volatile complexity Shoulder,Beauty,9.93,6.74,Holt Inc,2025-05-24
593,Universal logistical knowledge user Represent,Toys,37.02,21.23,Campos-Robinson,2024-07-04
594,Assimilated systematic middleware Task,Clothing,97.32,60.25,Cox Inc,2024-08-05
595,Sharable interactive standardization Still,Home & Garden,60.7,22.49,"Ryan, Roth and Matthews",2025-06-04
596,Multi-tiered heuristic knowledgebase Wife,Books,6.85,4.03,Wilkins Inc,2023-10-19
597,Implemented national superstructure Language,Toys,39.79,21.77,"Carpenter, Ortiz and Smith",2024-09-29
598,Multi-layered radical knowledge user Letter,Sports,11.82,3.98,"Rice, Castillo and Frye",2024-10-09
599,Switchable foreground policy When,Sports,12.61,4.35,"Carter, Rose and Brooks",2024-11-28
600,Persistent mobile Internet solution Meet,Beauty,13.88,4.77,"Lambert, Moore and Bell",2025-05-21
601,Extended system-worthy secured line Structure,Electronics,35.33,20.84,Gonzales-Mills,2024-12-29
602,Self-enabling motivating adapter Among,Electronics,43.27,15.43,Rogers-Steele,2025-07-10
603,Persistent foreground alliance Sign,Clothing,18.57,9.05,Collins-Thomas,2023-12-18
604,Open-source multi-tasking challenge Dark,Sports,18.82,8.33,Snyder LLC,2025-08-09
605,Streamlined upward-trending encryption Statement,Toys,29.12,15.15,Miller and Sons,2024-07-01
606,Phased disintermediate definition Others,Beauty,31.64,18.43,Lara and Sons,2025-03-10
607,Front-line even-keeled Local Area Network Sport,Toys,51.47,29.54,"Russell, Alexander and Lynch",2024-08-22
608,Horizontal system-worthy array With,Home & Garden,7.19,3.64,Hodge and Sons,2023-10-04
609,Synchronized uniform conglomeration Leader,Electronics,20.41,9.91,Coleman Inc,2023-10-26
610,Proactive next generation middleware Interview,Automotive,8.55,3.93,"Woodward, Kelly and Lee",2024-01-26
611,Mandatory local application Likely,Toys,19.28,12.43,Cantrell PLC,2024-07-17
612,Fully-configurable secondary moratorium West,Sports,16.76,7.25,"Cole, Barker and White",2023-10-07
613,Multi-layered empowering initiative About,Books,19.35,7.81,Simon Ltd,2024-11-13
614,User-friendly value-added system engine Here,Beauty,10.59,6.33,Beck Group,2023-10-28
615,Distributed attitude-oriented knowledgebase Understand,Clothing,6.11,2.71,Cole-Robinson,2024-07-03
616,Expanded client-driven architecture Energy,Electronics,3.76,2.4,King LLC,2024-06-13
617,Extended 24hour productivity Go,Electronics,18.08,7.8,"Sanchez, Reyes and Sanford",2024-07-24
618,Profound leadingedge software Opportunity,Home & Garden,14.23,8.26,Thomas-Perez,2024-02-03
619,Reduced composite website Production,Electronics,11.7,3.72,Gillespie LLC,2024-01-09
620,Profound multi-tasking access Community,Beauty,57.86,26.28,"Bell, Robinson and Owens",2025-04-24
621,Universal zero-defect service-desk Yes,Sports,10.1,4.42,"Evans, Webb and Mcdonald",2023-12-06
622,Diverse optimizing protocol Technology,Sports,62.39,39.1,Robinson-Marks,2023-11-19
623,Monitored full-range time-frame Society,Sports,73.63,50.57,"Best, Flores and Herrera",2025-02-13
624,Proactive hybrid process improvement Something,Automotive,4.22,2.04,"Thomas, Khan and Jordan",2025-03-11
625,Extended analyzing migration Necessary,Books,21.63,13.63,Evans-Cochran,2024-12-29
626,Public-key didactic methodology Teach,Books,14.59,8.46,Gates-Kerr,2024-08-07
627,Synergized 5thgeneration intranet Piece,Automotive,1.96,1.35,"Huerta, Reed and Walsh",2025-01-03
628,Upgradable optimal success Authority,Electronics,6.32,3.95,"Hudson, Robinson and Johnson",2025-04-06
629,Team-oriented systematic policy Step,Toys,37.34,12.36,Marquez PLC,2025-07-27
630,Up-sized 24/7 instruction set Care,Books,101.02,59.13,Key-Galvan,2024-07-30
631,Ergonomic systemic protocol Range,Toys,41.35,21.26,Caldwell-Rhodes,2024-05-14
632,Configurable grid-enabled support Father,Toys,26.02,7.98,"Collins, Lin and Blackburn",2024-11-18
633,Face-to-face zero administration function Finally,Books,19.75,7.91,"Dickerson, Gonzalez and Patel",2024-03-20
634,Secured attitude-oriented open system The,Automotive,77.18,51.61,Wilson-Smith,2025-05-09
635,Pre-emptive fault-tolerant knowledgebase About,Home & Garden,112.01,75.09,Johnson-Foster,2023-10-09
636,Sharable needs-based forecast Number,Books,12.56,7.78,Spears LLC,2024-04-05
637,User-friendly hybrid matrix Capital,Clothing,4.06,2.81,Cox-Davis,2024-03-11
638,Customizable tertiary intranet Somebody,Automotive,3.75,2.33,Galvan-Drake,2024-08-29
639,Visionary cohesive frame Poor,Clothing,57.83,17.59,"Gardner, Hart and Morales",2024-08-24
640,Progressive responsive functionalities Them,Toys,19.34,8.03,"Salas, Blackwell and Miller",2025-03-12
641,Reduced homogeneous encoding Establish,Clothing,23.26,7.26,"Rose, Johnson and Freeman",2024-01-03
642,Exclusive interactive hub Then,Electronics,4.79,1.62,"Shaw, Bass and Watkins",2023-09-05
643,Up-sized actuating pricing structure Enough,Sports,11.0,4.26,Colon Ltd,2025-04-05
644,Customer-focused intangible circuit Program,Home & Garden,15.86,7.95,Khan PLC,2024-03-22
645,Total zero-defect solution Sport,Electronics,23.72,15.16,May LLC,2024-05-09
646,Object-based logistical conglomeration Exactly,Sports,14.6,9.41,Jackson-Marks,2024-02-09
647,Advanced motivating portal Hundred,Home & Garden,8.76,4.79,Brown Inc,2025-07-10
648,Diverse next generation secured line Mind,Toys,10.72,7.2,Fowler-Madden,2024-02-07
649,Centralized attitude-oriented structure Employee,Home & Garden,52.81,26.41,Powell Group,2024-07-26
650,Digitized bandwidth-monitored hub Two,Home & Garden,24.43,16.02,Bishop-Cooper,2025-03-08
651,Object-based interactive knowledge user Assume,Clothing,32.78,15.79,Cook and Sons,2025-04-19
652,Cloned systematic process improvement Ball,Clothing,9.79,4.02,Walter-Cobb,2024-06-13
653,Profound maximized capability Majority,Clothing,1.89,1.26,"Mays, Jones and Weiss",2024-11-17
654,Customizable 24hour flexibility Stock,Home & Garden,13.22,6.02,Page-Miller,2025-04-18
655,Managed transitional pricing structure Page,Beauty,10.04,5.03,"Smith, Anderson and Wright",2024-08-06
656,Right-sized cohesive structure Voice,Automotive,26.55,11.46,Mccarthy-Johnson,2024-11-24
657,Balanced methodical workforce Bar,Home & Garden,278.27,157.26,"Wells, Wright and Peterson",2023-11-04
658,Programmable real-time neural-net World,Automotive,35.03,24.45,Diaz-Decker,2025-02-08
659,Synchronized 3rdgeneration collaboration Consider,Automotive,179.25,55.6,Mays and Sons,2024-07-21
660,Configurable dynamic benchmark One,Clothing,31.66,20.89,Roman and Sons,2023-12-02
661,Reduced secondary infrastructure Alone,Home & Garden,12.13,3.66,Hicks-Elliott,2024-08-09
662,Intuitive 5thgeneration core Why,Clothing,26.53,11.82,"Brown, Ortiz and King",2024-06-22
663,Integrated human-resource benchmark Trip,Clothing,83.47,30.67,Mcknight Inc,2023-12-12
664,Sharable background leverage Economy,Clothing,86.8,52.33,Taylor-Landry,2025-04-24
665,Implemented background matrices Way,Toys,12.68,4.06,"Brown, Valdez and Pittman",2025-05-10
666,Triple-buffered eco-centric array Family,Toys,24.6,12.83,Clark-Hess,2024-03-17
667,Open-source grid-enabled hierarchy First,Beauty,6.4,2.68,Warren Group,2024-02-24
668,Inverse attitude-oriented workforce Cover,Sports,38.85,13.73,"Gibson, Smith and Jones",2024-11-07
669,Fully-configurable demand-driven Graphical User Interface Himself,Automotive,69.59,42.36,"Simpson, Ayers and Clark",2024-06-30
670,Reverse-engineered asynchronous instruction set Student,Home & Garden,20.74,8.03,Fleming LLC,2025-01-10
671,Versatile exuding synergy President,Electronics,11.78,4.59,Ward-Lopez,2025-07-21
672,Cross-group grid-enabled projection Item,Clothing,26.79,10.98,"Rodriguez, Compton and Hernandez",2023-09-25
673,Open-architected content-based algorithm Road,Beauty,28.05,15.0,Barrera-Smith,2025-03-25
674,Exclusive homogeneous customer loyalty Early,Electronics,21.43,12.08,"Carpenter, Lee and Morrow",2024-06-24
675,Profound incremental structure Foot,Toys,23.17,7.11,Howard Inc,2024-02-05
676,Profound impactful groupware After,Sports,17.48,6.94,Ramirez-Smith,2023-09-16
677,Business-focused local frame Everybody,Home & Garden,44.56,21.05,King-Dyer,2023-09-16
678,Expanded fresh-thinking conglomeration Way,Automotive,36.2,15.67,Santos Ltd,2024-08-13
679,Intuitive solution-oriented ability Attack,Automotive,9.15,5.98,Holt-Soto,2024-11-17
680,Re-contextualized background installation History,Toys,8.95,5.5,Lee-Kelley,2024-10-03
681,Focused hybrid firmware Main,Beauty,16.39,9.02,Lopez LLC,2023-12-30
682,Ameliorated hybrid projection Learn,Clothing,36.21,15.76,Conway-Bender,2024-01-26
683,Seamless interactive workforce Process,Clothing,22.61,13.12,"Campbell, Santos and Osborne",2025-02-18
684,Vision-oriented systematic matrices Mention,Automotive,12.01,7.66,Norman Group,2024-02-01
685,Profit-focused responsive attitude Term,Clothing,24.76,13.32,"Horn, Daniel and Reed",2024-12-26
686,Expanded empowering architecture For,Automotive,15.42,9.46,"Hill, Nichols and Brown",2025-04-08
687,Mandatory coherent focus group Yourself,Beauty,40.63,24.36,Martin Ltd,2025-05-18
688,Grass-roots neutral Internet solution Face,Toys,26.22,13.86,Krause-Parks,2025-03-04
689,Visionary optimal architecture Reveal,Electronics,15.61,6.63,Davis Inc,2024-10-22
690,Intuitive didactic hardware Whose,Sports,24.17,14.46,Todd-Sawyer,2024-11-11
691,Assimilated object-oriented adapter Relate,Home & Garden,57.51,22.01,Rogers Group,2025-06-27
692,Fundamental dedicated hardware Simple,Automotive,12.73,7.79,"Lee, Acosta and Roth",2023-10-16
693,Versatile asynchronous model Factor,Sports,27.72,17.24,Barrera-Bell,2024-08-20
694,Balanced homogeneous database Piece,Toys,18.98,11.94,Joseph PLC,2024-09-09
695,Distributed radical structure Even,Clothing,28.26,13.82,Sullivan Group,2024-09-02
696,Sharable upward-trending initiative Himself,Sports,11.9,4.49,Davidson-Jones,2025-03-26
697,Cross-platform zero-defect database Check,Electronics,21.94,7.46,Rosales PLC,2024-01-23
698,Persevering attitude-oriented application Already,Books,48.73,29.11,Smith and Sons,2025-01-14
699,Innovative regional projection Pass,Toys,9.49,6.21,"Hill, Gonzalez and Barber",2024-12-17
700,Customer-focused context-sensitive interface Space,Books,6.93,3.88,Smith Ltd,2024-05-27
701,Vision-oriented even-keeled system engine Eat,Home & Garden,7.15,2.56,"Scott, Rivera and Hutchinson",2025-06-18
702,Programmable empowering system engine Marriage,Home & Garden,7.87,5.3,Bright-Lopez,2024-07-08
703,Universal 4thgeneration superstructure Poor,Sports,32.34,22.5,Stevens and Sons,2024-02-05
704,Realigned bandwidth-monitored orchestration Suddenly,Home & Garden,6.52,3.09,Clark-Scott,2024-12-13
705,Diverse secondary adapter Him,Toys,15.83,8.52,Martinez-Collins,2024-01-08
706,Business-focused real-time attitude Identify,Beauty,32.94,20.12,"Barnes, Montgomery and Hicks",2023-10-14
707,Extended disintermediate open system Require,Automotive,28.03,16.67,"Santos, Bentley and Lee",2023-11-10
708,User-centric coherent protocol Either,Electronics,14.75,10.13,Hurst and Sons,2024-09-12
709,Object-based clear-thinking functionalities Pass,Clothing,23.4,8.1,Johnson-Krueger,2024-08-04
710,Face-to-face client-driven neural-net Later,Clothing,21.88,11.65,West Group,2024-10-21
711,Multi-lateral mobile synergy Stock,Automotive,16.79,9.68,Curtis-Bowman,2025-07-15
712,Decentralized bifurcated solution Travel,Sports,16.97,11.13,Lee PLC,2025-03-25
713,Robust composite strategy Finally,Clothing,120.1,78.02,Vasquez-Rodriguez,2023-11-06
714,Re-engineered value-added benchmark Challenge,Sports,38.38,26.53,Eaton-Morgan,2025-03-16
715,Profound zero administration synergy Where,Automotive,146.13,73.77,Hobbs-Joseph,2024-06-11
716,Visionary didactic ability Usually,Home & Garden,13.5,8.54,"Rogers, Martin and Kramer",2023-12-06
717,Assimilated interactive conglomeration Truth,Automotive,18.77,8.84,"Beasley, Contreras and Werner",2024-06-10
718,Front-line well-modulated monitoring Budget,Home & Garden,6.92,3.24,Johnson LLC,2024-12-29
719,Profound didactic projection Prevent,Beauty,10.51,4.22,Walters and Sons,2025-06-16
720,Down-sized encompassing hierarchy Business,Beauty,91.98,57.7,"Arellano, Anderson and Noble",2024-11-05
721,Operative modular orchestration Behind,Electronics,13.23,9.19,Lopez Ltd,2024-09-29
722,Proactive local initiative Can,Automotive,93.26,37.54,"Mendoza, Clark and Turner",2024-08-22
723,Synergized transitional orchestration Leave,Clothing,7.43,2.4,Howard Inc,2024-07-23
724,Advanced mobile process improvement Take,Toys,8.65,5.42,Martinez LLC,2024-02-04
725,Configurable bandwidth-monitored leverage Chance,Beauty,15.29,8.38,"Luna, Allen and Gonzalez",2024-04-29
726,Seamless coherent encoding Drive,Automotive,19.09,13.06,Perry-Ramirez,2025-03-14
727,Triple-buffered fresh-thinking open system Can,Electronics,42.03,16.85,Russell LLC,2025-01-21
728,Fully-configurable upward-trending database High,Books,28.81,9.46,"Brooks, Dean and Torres",2023-11-16
729,Expanded attitude-oriented hub End,Beauty,14.4,7.16,Obrien Group,2025-08-08
730,Multi-channeled intermediate concept Seek,Electronics,18.05,6.03,"Neal, Morris and Benson",2023-09-24
731,Versatile needs-based knowledgebase Serve,Sports,15.56,6.3,Mckinney LLC,2024-05-18
732,Devolved transitional function Health,Sports,9.66,3.38,Solis-Swanson,2025-06-04
733,Total scalable adapter Spend,Electronics,9.87,3.85,Horton PLC,2025-01-31
734,Future-proofed transitional solution Ahead,Home & Garden,45.71,15.65,Jimenez-Lee,2025-04-27
735,Re-engineered eco-centric benchmark Exactly,Books,4.65,3.17,Perkins-Savage,2025-05-10
736,Organized static methodology Believe,Electronics,73.25,30.14,Weaver Inc,2024-12-25
737,Versatile interactive neural-net Company,Beauty,15.27,7.29,"Holland, Fox and Long",2024-12-15
738,Public-key static pricing structure Nothing,Home & Garden,10.83,7.14,Clements-Ross,2024-08-11
739,Enhanced asynchronous monitoring Rather,Electronics,36.3,20.72,Li and Sons,2024-01-29
740,De-engineered explicit forecast Imagine,Clothing,65.9,36.06,"Cochran, Morrison and Davis",2024-04-06
741,Reactive cohesive attitude Instead,Beauty,49.11,28.59,Dennis-Gray,2024-04-07
742,Ergonomic homogeneous capacity Piece,Beauty,30.01,18.95,Phillips Group,2025-04-15
743,Pre-emptive 24hour data-warehouse Necessary,Sports,47.92,31.2,Smith-Kelly,2025-07-16
744,Optional secondary forecast Quickly,Clothing,5.09,2.84,Estrada-Wilson,2024-07-02
745,Total stable productivity Quality,Clothing,13.23,8.68,"Frederick, Green and Johnson",2024-09-27
746,Organic discrete circuit Sense,Automotive,9.69,4.98,Watson-Nelson,2024-05-10
747,Diverse didactic challenge Certainly,Automotive,53.5,21.98,Sanders-Davis,2025-05-04
748,Function-based cohesive Internet solution Decision,Beauty,14.78,9.64,Hebert Group,2023-08-19
749,Organized next generation success Difficult,Books,39.5,20.41,Sutton-Lang,2023-09-15
750,Object-based multimedia synergy Bar,Toys,30.84,20.43,"Hill, Harper and Smith",2024-12-11
751,Diverse global extranet Body,Automotive,10.08,3.19,Lara-Bailey,2024-04-02
752,Implemented global challenge World,Home & Garden,12.56,5.77,Palmer LLC,2024-07-31
753,Programmable zero-defect matrix Yeah,Sports,56.55,38.4,Gutierrez-Underwood,2024-12-08
754,Quality-focused even-keeled matrices Hand,Clothing,10.8,4.32,Walker Ltd,2025-01-24
755,Seamless 24hour focus group Evening,Sports,22.2,15.02,"Nguyen, Singleton and Rodriguez",2024-03-07
756,Persistent executive standardization Believe,Beauty,10.74,7.32,"Patel, Moore and Cisneros",2024-08-06
757,Organic interactive function Difficult,Home & Garden,15.62,10.2,Singleton PLC,2025-03-28
758,Future-proofed encompassing archive About,Electronics,19.36,10.17,Tucker-Johnson,2025-01-16
759,Monitored logistical parallelism Firm,Clothing,10.74,6.0,"Simmons, Ortiz and Stevenson",2025-04-01
760,Synchronized upward-trending alliance Imagine,Home & Garden,9.32,6.04,Santiago-Reynolds,2025-06-24
761,Team-oriented fresh-thinking contingency Someone,Toys,25.25,15.41,Nelson PLC,2024-11-20
762,Monitored didactic conglomeration Particular,Sports,10.22,5.64,"Robinson, Ayala and Evans",2023-12-23
763,Fully-configurable responsive capacity Executive,Beauty,10.5,7.28,Collins Group,2024-11-14
764,Innovative encompassing protocol Note,Home & Garden,9.48,5.44,"Bridges, Perkins and Rodgers",2024-02-15
765,Versatile discrete focus group Short,Electronics,18.87,13.02,Hicks and Sons,2025-06-10
766,Multi-layered bottom-line orchestration People,Automotive,42.73,13.8,Chambers-Abbott,2025-01-01
767,Multi-layered foreground ability Some,Automotive,67.04,23.84,Aguirre Ltd,2024-06-22
768,Reactive solution-oriented standardization Pm,Home & Garden,11.24,5.4,"Walker, Wells and Lewis",2025-04-11
769,Organized mission-critical functionalities Win,Beauty,112.2,50.93,Fowler-Barrett,2025-08-12
770,Fundamental modular challenge Series,Sports,8.99,5.51,"Williams, Michael and Miller",2025-06-07
771,Quality-focused zero tolerance capability Six,Clothing,47.79,17.41,"Miller, Myers and Hopkins",2025-01-04
772,Inverse static knowledge user Ahead,Toys,11.28,7.79,West-Baker,2023-11-03
773,Optimized interactive conglomeration Half,Toys,10.01,4.26,Osborne-West,2024-06-14
774,Universal 24hour benchmark Season,Clothing,11.07,5.22,Bass-Rangel,2025-06-12
775,Optimized context-sensitive contingency Agree,Books,19.26,7.89,Anderson Group,2024-07-02
776,Innovative content-based protocol There,Sports,31.94,16.98,Patel Inc,2025-06-19
777,Organized leadingedge capability Event,Toys,34.33,11.1,Williamson-King,2023-12-15
778,Seamless executive neural-net With,Books,9.44,3.4,Alvarado and Sons,2025-07-23
779,Phased composite forecast National,Books,9.1,5.44,Mullins-Jimenez,2025-03-07
780,Function-based optimal capacity Laugh,Beauty,9.65,3.61,"Miller, Espinoza and Owens",2025-02-13
781,Customizable grid-enabled conglomeration Wish,Beauty,18.37,7.24,Reeves LLC,2024-12-03
782,Programmable web-enabled software Resource,Beauty,16.98,10.48,Cortez PLC,2023-09-18
783,Front-line 24hour Graphic Interface Society,Electronics,9.39,3.17,"Ford, Farley and Smith",2024-10-14
784,Optimized neutral challenge Should,Sports,24.92,11.84,Jones-Brown,2024-07-28
785,Business-focused next generation application Movie,Clothing,122.74,37.95,"Aguilar, Robbins and Wolfe",2024-11-05
786,Enhanced 3rdgeneration success Matter,Sports,13.41,5.88,"Chen, Douglas and Martinez",2025-07-07
787,Stand-alone motivating ability Phone,Beauty,14.2,8.23,Herman LLC,2025-06-30
788,Profit-focused multimedia contingency Congress,Electronics,31.43,10.56,Myers LLC,2023-11-29
789,Automated optimal capacity Heart,Sports,12.84,8.41,Thomas Group,2024-11-02
790,Enhanced responsive budgetary management Above,Sports,34.3,22.77,Johnson-Howard,2024-06-18
791,Stand-alone tertiary website Personal,Books,11.3,3.86,Davenport PLC,2024-10-10
792,Grass-roots zero administration circuit Deal,Sports,86.98,60.56,"Murphy, Kirby and Pham",2025-07-02
793,Sharable grid-enabled service-desk Event,Books,26.46,11.09,"Schneider, Stout and Santos",2024-06-10
794,Pre-emptive non-volatile artificial intelligence Development,Books,12.23,4.08,Hansen Inc,2024-02-14
795,Business-focused upward-trending complexity Might,Home & Garden,12.54,3.79,"Young, Chavez and Hill",2025-01-01
796,Vision-oriented optimal capacity People,Beauty,13.32,6.17,Hawkins Inc,2025-05-05
797,Reduced 24/7 concept Forward,Toys,60.23,33.24,Johnson Ltd,2025-07-03
798,Cross-group 3rdgeneration access Stuff,Electronics,7.28,3.15,"Mcfarland, Scott and Johnson",2024-07-14
799,Synergistic composite concept Measure,Books,11.77,7.47,Small and Sons,2025-03-08
800,Right-sized next generation website Century,Sports,12.82,7.52,"Sims, Green and Pena",2025-03-18
801,Multi-lateral maximized orchestration Strategy,Books,19.84,8.73,"Barber, Sosa and Ellis",2024-09-01
802,Re-engineered multimedia moderator End,Books,16.17,9.6,Ross and Sons,2024-08-03
803,Managed zero tolerance pricing structure Rock,Books,6.09,4.12,Pearson Inc,2025-05-21
804,User-centric static extranet Without,Clothing,14.59,4.92,"Jones, Spencer and Kim",2024-07-15
805,Extended composite Internet solution Strategy,Toys,18.55,7.84,Adams Ltd,2024-02-13
806,Automated discrete conglomeration Though,Toys,12.15,5.9,Mclaughlin LLC,2024-12-14
807,Down-sized exuding application Ok,Clothing,34.79,17.37,"Cole, Smith and Lewis",2024-06-04
808,Adaptive solution-oriented Local Area Network Material,Clothing,41.91,21.66,Lambert-Greer,2024-06-12
809,Stand-alone 5thgeneration access Early,Clothing,18.86,7.93,Nelson-Reese,2024-02-12
810,Polarized zero administration monitoring Body,Toys,24.15,13.69,"Moore, Phelps and Carroll",2025-06-18
811,Pre-emptive bi-directional toolset Hand,Home & Garden,3.56,1.99,"Ramirez, Patel and Lozano",2024-06-02
812,Business-focused homogeneous moratorium Generation,Books,14.34,7.62,Gould-Bates,2023-11-25
813,Digitized explicit implementation Add,Home & Garden,44.87,15.5,"Robbins, Barnes and Church",2024-08-21
814,Profit-focused multimedia open architecture Style,Sports,14.31,7.02,"Benson, Campbell and Ewing",2024-02-19
815,Reduced holistic orchestration Color,Toys,11.14,4.93,Hernandez LLC,2024-06-26
816,Synergistic actuating moratorium General,Beauty,124.23,61.67,"Gray, Bell and Jacobson",2023-08-26
817,Customizable heuristic artificial intelligence Statement,Toys,86.08,57.57,Todd Inc,2023-09-01
818,Enterprise-wide client-driven project Trade,Electronics,29.2,14.37,"Myers, Marshall and Perez",2025-04-22
819,Profound intangible info-mediaries Answer,Home & Garden,49.96,15.27,Myers Ltd,2025-05-01
820,Ameliorated object-oriented paradigm Price,Clothing,3.38,1.61,James Inc,2024-08-03
821,Universal logistical solution Figure,Automotive,10.7,6.72,Mathis PLC,2024-05-24
822,Re-engineered even-keeled budgetary management Board,Clothing,13.79,8.44,"Wells, Zimmerman and Harrison",2024-05-29
823,Vision-oriented leadingedge budgetary management Hour,Sports,16.63,8.4,Martin-Oliver,2023-08-26
824,Reduced analyzing encoding Into,Books,13.57,5.43,Jimenez-Brooks,2024-03-04
