product_id,product_name,category,price,cost,supplier,launch_date
825,Implemented motivating success Middle,Electronics,2.61,1.27,Gordon-Maynard,2023-08-25
826,Fully-configurable methodical capacity Same,Home & Garden,27.35,14.37,"Owen, Carroll and Scott",2025-01-04
827,Monitored reciprocal service-desk Suddenly,Books,31.03,21.72,Adams PLC,2024-10-25
828,Switchable zero-defect adapter Somebody,Books,72.35,40.35,"Ramirez, Sanchez and Ballard",2024-03-19
829,Customer-focused client-server functionalities Play,Beauty,10.69,6.18,"Berg, Mccoy and Sullivan",2023-11-14
830,Re-engineered interactive middleware Family,Beauty,10.01,4.97,Martinez Group,2025-02-18
831,Programmable system-worthy database Exist,Home & Garden,2.35,1.04,"Morgan, Hardin and Gutierrez",2024-01-17
832,Virtual discrete standardization Central,Home & Garden,15.88,9.93,Rose-Cook,2024-09-17
833,Re-contextualized systemic solution Letter,Home & Garden,41.3,20.57,"Taylor, Montgomery and Miranda",2024-02-13
834,Quality-focused stable interface Production,Home & Garden,12.31,8.59,Austin Inc,2025-04-15
835,Pre-emptive asynchronous groupware Forget,Clothing,111.58,53.88,May Inc,2024-09-09
836,Switchable contextually-based workforce Test,Toys,16.36,5.35,"Duncan, Clark and Gray",2024-11-05
837,Upgradable non-volatile solution Sound,Toys,22.59,12.94,Wright PLC,2023-09-26
838,Mandatory systematic process improvement Wind,Books,6.75,2.15,"Singh, Joyce and Chen",2023-11-01
839,Right-sized well-modulated Graphic Interface Suggest,Toys,25.27,10.11,"Gonzales, May and Vang",2023-10-08
840,Pre-emptive attitude-oriented toolset Party,Automotive,4.12,1.82,Dillon Ltd,2024-08-08
841,Innovative leadingedge secured line True,Books,34.99,20.85,Hancock PLC,2024-04-20
842,Streamlined modular application Another,Clothing,35.86,17.85,Cole PLC,2025-07-29
843,Persistent background policy Task,Automotive,59.59,18.56,Craig Group,2023-12-11
844,Configurable user-facing project Sea,Toys,8.88,4.86,Mcdonald PLC,2025-04-25
845,User-friendly actuating emulation Hit,Books,22.84,10.61,Morris-Beard,2024-10-13
846,Ergonomic directional initiative Teacher,Home & Garden,31.53,21.09,Bryant Group,2024-12-31
847,Face-to-face grid-enabled process improvement Church,Electronics,28.61,14.3,Vaughn Inc,2023-11-27
848,Customizable responsive leverage Country,Toys,10.05,5.87,Copeland-Morgan,2023-08-21
849,Exclusive encompassing access Ground,Automotive,2.96,1.15,Gray-Hamilton,2025-05-08
850,Versatile responsive array Hotel,Beauty,26.51,16.02,Vaughn Ltd,2025-07-11
851,Inverse national success Word,Automotive,17.78,10.46,Myers Ltd,2024-12-28
852,Quality-focused secondary Internet solution Kitchen,Automotive,12.76,8.44,"Contreras, Wilson and Hendricks",2024-08-16
853,Fully-configurable bifurcated protocol Range,Beauty,37.01,11.6,Hogan and Sons,2024-11-23
854,Future-proofed static definition Number,Books,19.38,9.28,Clark Inc,2023-08-27
855,Persistent analyzing implementation Break,Electronics,6.99,4.0,Donaldson-White,2024-09-07
856,Cloned global framework Child,Beauty,4.28,1.45,Hall PLC,2024-08-27
857,Customizable bifurcated standardization Nearly,Toys,8.14,3.78,"Bonilla, Duncan and Briggs",2025-06-10
858,Virtual motivating process improvement Sure,Electronics,136.24,92.22,Turner PLC,2024-12-28
859,Mandatory reciprocal extranet Picture,Automotive,35.81,16.99,Hart-Moran,2025-08-01
860,Triple-buffered bifurcated process improvement Choose,Clothing,23.36,16.22,Jimenez Inc,2024-11-11
861,Up-sized tertiary info-mediaries Gas,Sports,17.37,5.61,Thompson and Sons,2025-01-09
862,Synchronized optimal groupware Buy,Books,16.48,9.68,Ingram-Bass,2024-09-11
863,Phased demand-driven emulation Indeed,Clothing,51.1,27.21,"Cain, Garner and Singh",2025-03-04
864,Streamlined human-resource interface Focus,Clothing,13.57,6.79,"Ruiz, Doyle and Harper",2025-03-03
865,Reactive bottom-line focus group Dog,Electronics,31.87,21.94,White and Sons,2024-10-08
866,Cross-group didactic toolset Little,Books,15.2,5.35,"Wall, Oliver and Montgomery",2025-01-27
867,Fundamental 3rdgeneration task-force Size,Clothing,94.83,62.44,Jones and Sons,2024-06-25
868,Adaptive tangible array Our,Home & Garden,36.37,20.97,Smith-Mitchell,2023-11-22
869,Quality-focused analyzing budgetary management That,Clothing,54.4,21.96,Khan-Reeves,2025-07-30
870,Customer-focused 24hour installation End,Home & Garden,12.58,8.31,"Tran, Morris and Bradshaw",2024-09-22
871,Realigned composite contingency Eye,Sports,46.83,22.09,Mccarthy-Guzman,2023-12-31
872,Future-proofed disintermediate complexity If,Home & Garden,15.64,9.79,Schaefer Inc,2024-06-03
873,Monitored zero administration firmware Wide,Home & Garden,21.93,9.99,Munoz PLC,2024-07-04
874,Re-contextualized upward-trending functionalities Be,Electronics,74.29,47.57,Gonzalez Group,2025-02-16
875,Synchronized multimedia portal Process,Clothing,8.72,4.84,"Henderson, Collins and Allen",2023-10-10
876,Switchable motivating capability Quality,Sports,23.63,8.42,Mejia PLC,2024-07-04
877,Reduced mobile middleware Ready,Clothing,28.51,15.96,Miller PLC,2024-07-14
878,Switchable full-range Graphic Interface Attention,Toys,30.45,11.47,Watts Ltd,2024-03-07
879,Organized radical budgetary management Half,Toys,14.0,6.51,"Robinson, Wright and Gonzalez",2023-09-18
880,Horizontal disintermediate initiative Particularly,Home & Garden,106.59,39.24,Hardin Ltd,2025-07-07
881,Realigned 6thgeneration project Water,Beauty,7.13,2.2,Burgess-Bass,2023-12-28
882,Extended encompassing hierarchy Play,Home & Garden,64.53,24.83,Blackburn Group,2024-10-19
883,Universal eco-centric monitoring Phone,Clothing,53.09,27.32,Evans Inc,2024-12-27
884,Expanded 4thgeneration forecast Practice,Automotive,91.9,45.27,Porter-Gutierrez,2023-08-20
885,Future-proofed actuating moderator Any,Sports,5.64,2.82,"Roberts, Diaz and Barrera",2023-11-27
886,Robust asymmetric alliance Accept,Beauty,10.02,4.0,Escobar Ltd,2025-07-09
887,Operative optimizing Graphic Interface Institution,Sports,66.26,38.04,Herrera-Wagner,2025-08-03
888,Seamless needs-based array Player,Electronics,4.47,2.6,"Jones, Sanders and Sosa",2024-10-26
889,Public-key tangible data-warehouse Cup,Home & Garden,5.56,2.46,"Roberts, Villanueva and Lindsey",2023-09-07
890,Ergonomic attitude-oriented infrastructure Many,Home & Garden,13.59,8.87,"Lopez, Galvan and Brown",2023-12-08
891,Reverse-engineered well-modulated concept Improve,Toys,23.42,13.06,"Henry, Wagner and Joseph",2023-12-28
892,Networked executive adapter Sound,Electronics,71.79,42.01,Reeves-Mills,2025-07-21
893,Total disintermediate strategy Anything,Toys,17.32,7.12,"Clark, Banks and Williams",2024-01-04
894,Organized grid-enabled ability Great,Clothing,12.35,3.71,Forbes PLC,2025-01-26
895,Re-contextualized object-oriented open system Agreement,Home & Garden,25.77,16.65,"Leon, Barker and Sellers",2024-04-07
896,Streamlined intermediate focus group Against,Clothing,29.24,18.39,Moore-Hernandez,2024-04-02
897,Programmable bifurcated approach How,Sports,28.59,9.99,Valdez Ltd,2025-06-01
898,Organized bifurcated approach Parent,Beauty,17.42,7.83,Evans-Yang,2024-06-14
899,Customer-focused leadingedge process improvement How,Beauty,4.2,2.37,"Young, Johnson and Weber",2024-07-19
900,Multi-layered bandwidth-monitored adapter Summer,Beauty,9.64,5.41,Adams-Smith,2023-10-21
901,Inverse real-time complexity Themselves,Toys,62.57,40.3,"Harris, Gill and Adams",2025-02-09
902,Assimilated needs-based implementation Get,Books,23.33,8.31,Morgan Group,2024-07-03
903,Extended uniform methodology Figure,Electronics,15.52,7.33,Taylor-George,2024-04-27
904,Reduced encompassing help-desk Rock,Beauty,49.13,16.65,Davis-Crawford,2023-10-28
905,Multi-channeled transitional monitoring Deal,Home & Garden,8.13,3.71,Dunn-Alvarez,2024-08-19
906,Right-sized content-based artificial intelligence Network,Electronics,16.77,5.13,Williams-Lewis,2025-02-10
907,Multi-lateral upward-trending Internet solution Image,Sports,22.43,14.79,Hunter Ltd,2025-05-21
908,Upgradable transitional groupware Establish,Sports,14.11,7.21,Miller PLC,2024-05-23
909,Re-contextualized dynamic extranet Why,Toys,21.77,13.93,Brooks Inc,2024-10-27
910,Persistent multimedia benchmark Student,Sports,17.29,5.6,"Cline, Smith and Davidson",2024-07-19
911,Digitized zero administration installation Nation,Sports,6.56,2.56,"Watkins, Hammond and Padilla",2024-06-22
912,Reactive multimedia superstructure Capital,Automotive,23.22,9.38,Mcfarland and Sons,2024-06-30
913,Adaptive methodical product Win,Books,6.94,3.16,Mccullough-Johnson,2024-01-07
914,Self-enabling user-facing open architecture Tv,Automotive,22.93,14.24,"Grimes, Bird and Turner",2025-06-07
915,Multi-tiered tertiary product Remain,Clothing,60.3,27.41,Williams-Lawson,2024-06-26
916,Front-line context-sensitive approach Be,Clothing,16.04,6.13,Harris-Brown,2024-05-19
917,Right-sized maximized analyzer Production,Automotive,7.87,2.57,Farmer-Coleman,2024-09-07
918,Extended 3rdgeneration matrix Product,Beauty,18.15,6.02,"Carter, Huang and Bautista",2025-05-11
919,Vision-oriented multi-tasking capability Majority,Books,10.32,6.23,Mcguire-Mcdonald,2023-09-27
920,User-centric interactive capacity Enjoy,Toys,32.32,15.45,Flowers-Mccall,2024-04-06
921,Universal context-sensitive Graphic Interface Government,Clothing,17.84,10.53,"Perry, Norris and Howe",2025-07-22
922,Progressive needs-based budgetary management Become,Automotive,78.87,45.19,"Ferguson, Miles and Hart",2024-02-03
923,Stand-alone user-facing structure They,Toys,50.93,18.04,Martinez-Melton,2024-10-13
924,Secured solution-oriented budgetary management Company,Toys,17.77,6.35,Jackson-Willis,2025-05-10
925,User-centric leadingedge Local Area Network Kid,Sports,35.61,21.44,Mcguire-Payne,2024-10-02
926,Cross-platform high-level attitude Offer,Clothing,14.66,8.63,Brown Inc,2024-01-21
927,Assimilated local middleware Trade,Electronics,20.64,9.31,"Church, Parker and Williams",2024-01-18
928,Future-proofed fault-tolerant capacity Everyone,Beauty,15.04,4.98,Rose and Sons,2025-03-25
929,Networked maximized Internet solution Stay,Clothing,37.08,11.3,Mccall-Reid,2024-11-03
930,Total 3rdgeneration approach Environmental,Electronics,63.21,26.25,Williams LLC,2024-01-01
931,Switchable client-driven website Hair,Home & Garden,38.05,11.56,Wilson Group,2024-01-18
932,Robust leadingedge installation Four,Electronics,41.99,16.46,"Martin, Combs and Kemp",2025-01-22
933,Proactive background contingency Ground,Electronics,42.03,19.66,Clay-Mcclain,2025-03-07
934,Function-based exuding hardware Offer,Sports,31.22,10.88,"Palmer, Galloway and Collins",2024-09-26
935,Innovative leadingedge open system Red,Sports,8.07,2.76,David-Holloway,2024-03-10
936,Multi-channeled background policy Include,Beauty,78.32,51.58,Barnes-Johnson,2023-09-06
937,Cloned eco-centric orchestration Too,Sports,85.07,45.44,Hunter Ltd,2024-12-13
938,Seamless 3rdgeneration architecture Themselves,Electronics,16.66,11.23,"Matthews, Cook and Cooke",2024-11-08
939,Switchable tertiary firmware Ahead,Books,14.93,6.54,Goodman-Smith,2025-02-20
940,Team-oriented optimizing adapter Good,Sports,32.78,18.71,Martinez-Williams,2023-11-17
941,Innovative secondary framework Foreign,Sports,31.21,11.92,Mendoza-Franco,2024-01-10
942,Re-engineered interactive concept Range,Automotive,17.09,9.35,"Poole, Hansen and Short",2025-04-10
943,User-friendly holistic circuit Them,Electronics,7.39,2.6,Mcfarland-Hughes,2024-06-20
944,Customizable intangible hardware Employee,Home & Garden,25.65,7.72,Martin Ltd,2025-07-09
945,Reactive reciprocal knowledgebase Technology,Home & Garden,31.22,21.0,"Salas, Phillips and Hall",2024-11-25
946,Vision-oriented user-facing data-warehouse Study,Automotive,35.9,18.74,"Lee, Arnold and Brown",2023-10-17
947,Reduced systematic application Lot,Clothing,26.56,17.82,Vega Inc,2024-08-05
948,Open-architected human-resource synergy Interest,Beauty,16.17,7.01,Lewis Ltd,2024-06-27
949,Pre-emptive heuristic standardization Civil,Home & Garden,44.49,19.18,Smith-Thomas,2025-04-04
950,Function-based secondary framework Court,Sports,21.17,9.74,Stewart and Sons,2024-03-02
951,Advanced disintermediate benchmark Third,Books,13.85,8.07,Rivera Inc,2024-11-07
952,Visionary fresh-thinking matrices Perform,Clothing,17.38,9.15,Thompson-Collins,2024-10-24
953,Reverse-engineered modular access Interview,Beauty,4.97,3.33,Harmon LLC,2024-05-27
954,Monitored zero tolerance open architecture Attorney,Books,17.36,5.38,Merritt-English,2024-07-30
955,Customer-focused clear-thinking focus group Home,Books,34.84,20.32,"Harris, Romero and Long",2024-07-28
956,Versatile analyzing utilization Material,Sports,26.36,11.39,Baker Group,2025-07-02
957,Organic neutral emulation Least,Electronics,67.8,25.23,Collins LLC,2024-04-04
958,Face-to-face fresh-thinking analyzer Republican,Electronics,16.27,8.2,Robinson-Reeves,2023-12-26
959,Secured intangible support Much,Electronics,29.66,14.89,"Kent, Espinoza and Holland",2024-07-28
960,Business-focused bi-directional open system Chair,Home & Garden,37.87,13.44,"Armstrong, Pittman and Summers",2024-01-27
961,Digitized logistical capability South,Electronics,130.88,49.83,"Stewart, Daniel and Curtis",2025-05-30
962,Vision-oriented intangible instruction set Congress,Beauty,22.55,10.45,"Phillips, Hall and Mayo",2024-04-18
963,Expanded real-time project Drop,Automotive,8.71,4.04,Nelson Inc,2024-11-01
964,Multi-channeled contextually-based instruction set Ability,Sports,39.58,16.9,Mccullough Inc,2024-10-20
965,Configurable maximized product Line,Automotive,89.35,32.11,"Ortega, Hull and Morgan",2024-03-08
966,Enhanced intangible Graphical User Interface Government,Home & Garden,15.52,4.68,Mason LLC,2023-09-29
967,Profit-focused asymmetric database Care,Beauty,39.36,27.08,"Palmer, Bailey and Cooper",2025-01-26
968,Optional bandwidth-monitored core Government,Electronics,53.68,36.36,Martinez-Hernandez,2025-01-28
969,Streamlined empowering challenge Thank,Beauty,45.32,22.36,"Alvarado, Gross and Carlson",2025-01-27
970,Organized 24hour artificial intelligence Remain,Automotive,22.21,15.5,"Hill, Brown and Hudson",2025-07-08
971,Reactive clear-thinking data-warehouse Degree,Books,11.49,6.54,Ayala-Ramos,2025-06-30
972,Stand-alone zero-defect capacity Quickly,Sports,18.82,6.16,Allen Inc,2024-08-06
973,Self-enabling analyzing application Compare,Sports,28.99,10.06,Olsen PLC,2023-09-07
974,Inverse systemic definition Animal,Automotive,41.54,27.68,Terry Group,2025-03-01
975,Grass-roots uniform initiative Market,Beauty,26.24,14.49,"Heath, Gomez and Powell",2025-05-10
976,Upgradable fault-tolerant adapter Statement,Clothing,14.82,9.44,"Peterson, Sandoval and Foley",2025-08-08
977,Persevering bandwidth-monitored moratorium Window,Automotive,31.32,20.65,Smith PLC,2024-04-24
978,Visionary transitional utilization Hotel,Sports,39.97,19.15,Brooks PLC,2024-04-06
979,Face-to-face discrete budgetary management Soon,Books,27.21,8.69,"Phillips, Crawford and Montoya",2024-08-15
980,Compatible global initiative Find,Automotive,10.29,3.86,"Ray, Dominguez and Cole",2023-12-15
981,Total motivating definition Game,Automotive,17.37,5.67,Jones-Garrison,2023-09-24
982,Operative context-sensitive support One,Sports,42.87,16.1,"Ramirez, Nguyen and Payne",2025-03-24
983,Persevering global core Rich,Automotive,6.64,3.08,"Wood, Hurley and Garcia",2024-12-11
984,Customer-focused zero-defect migration Evening,Clothing,3.76,1.31,Wilson-Jackson,2023-11-29
985,Quality-focused disintermediate encoding Human,Sports,67.12,24.61,Cross Inc,2024-07-19
986,Horizontal non-volatile collaboration Bring,Toys,30.24,14.46,"Chavez, Conway and Hickman",2024-03-13
987,Monitored coherent strategy Truth,Sports,32.63,14.23,Smith-Cole,2025-06-06
988,Reverse-engineered intangible extranet Himself,Clothing,8.49,4.14,Kramer-Solis,2025-06-27
989,Programmable maximized system engine At,Toys,36.23,17.09,"Fisher, Brown and Fitzgerald",2024-06-14
990,Multi-tiered human-resource core Rate,Toys,25.03,13.96,"Hardy, Oconnor and Rowe",2025-02-02
991,Seamless demand-driven structure Anyone,Sports,5.65,3.81,Trujillo-Parker,2024-04-28
992,Expanded clear-thinking complexity Big,Automotive,62.77,21.54,"Barber, Jordan and Thompson",2025-05-05
993,Optional well-modulated neural-net Sell,Beauty,22.8,7.75,Howard-Santos,2023-12-06
994,Profound 6thgeneration Local Area Network About,Home & Garden,14.63,9.38,Atkinson Group,2024-11-16
995,Cross-platform multimedia collaboration True,Toys,14.84,7.46,Harris-Snyder,2024-07-03
996,Configurable tangible groupware Great,Beauty,4.01,2.43,Anderson-Joyce,2024-08-08
997,Pre-emptive empowering workforce Than,Sports,32.29,12.47,"Bennett, Flynn and Mcconnell",2025-02-24
998,Synergistic background challenge Yourself,Electronics,24.77,15.64,Scott Inc,2024-11-21
999,Versatile holistic attitude Could,Electronics,17.2,11.52,"Lambert, Johnson and Edwards",2025-05-17
1000,Customer-focused needs-based moratorium Cut,Home & Garden,55.86,30.96,Snyder Ltd,2024-02-29
